,id,title,date,description,link,full text
12,trumps-was-preparing-for-impeachment-weeks-before-ukraine-scandal-now-he-wants-to-go-nuclear-on-biden-212443361.html,Trump was preparing for impeachment weeks before Ukraine scandal; now he wants to go nuclear on Biden,"Wed, 25 Sep 2019 17:24:43 -0400","Even before the Democrats announced plans for an impeachment inquiry on Tuesday, the White House and President Trump’s campaign were preparing a counterattack.",https://news.yahoo.com/trumps-was-preparing-for-impeachment-weeks-before-ukraine-scandal-now-he-wants-to-go-nuclear-on-biden-212443361.html,"WASHINGTON — Even before the Democrats announced plans for an impeachment inquiry on Tuesday, the White House and President Trump’s campaign were preparing a counterattack. And some elements of the Trump team’s impeachment strategy predated the current Ukraine scandal that sparked the Democrats’ action. Speaking at the United Nations General Assembly on Wednesday morning, shortly after the White House released a rough transcript of the July 25 call the president had with his Ukrainian counterpart that’s now at the center of the controversy, Trump argued there was a “witch hunt” against him. He accused Democrats and “corrupt” media of falsely portraying the conversation as a “call from hell.” “It turned out to be a nothing call,” Trump said. The summary of the call indicated Trump repeatedly asked Ukrainian President Volodymyr Zelensky to investigate the family of former Vice President Joe Biden, Trump’s potential Democratic rival in the 2020 election. Providing the rough transcript and insisting it shows no misconduct is just one facet of the Trump team’s response to the impeachment push. The president and his allies are also trying to turn the tables on Biden. Trump’s response also includes pointing at prior calls for impeachment to argue Democrats have been determined to oust him from office from day one, a defense against a potential impeachment that his campaign had prepared well before House Speaker Nancy Pelosi actually announced plans to open an inquiry on Tuesday. Following the release of the transcript, Trump’s campaign manager, Brad Parscale, released a statement describing the Ukraine scandal as “just another hoax from Democrats and the media.” “Because of their pure hatred for President Trump, desperate Democrats and the salivating media already had determined their mission: take out the President. The fact is that the President wants to fight the corruption in Washington, where the Bidens, the Clintons, and other career politicians have abused their power for personal gain for decades. The facts prove the President did nothing wrong,” Parscale said, echoing language of a prior statement he sent out shortly after Pelosi’s announcement. The idea there is a “Biden scandal” centers on a dubious claim that, as vice president in 2016, Biden pushed Ukraine’s government to oust a prosecutor who was investigating Burisma, a Ukrainian gas company that had Hunter Biden on its board starting in 2014. While Joe Biden did call for the prosecutor’s removal, he was one of many international leaders who did so in response to concerns about corruption. And Bloomberg News has reported that the investigation into Burisma had been closed prior to the vice president calling for the prosecutor’s ouster. In fact, in late 2014, the Obama administration pressed the Ukranians to assist the U.K. in a separate investigation into Burisma’s owner. Despite the lack of evidence, Rudy Giuliani, Trump’s personal attorney, began pressing the Ukrainians to investigate the Bidens role in the prosecutors firing earlier this year. Tim Murtaugh, communications director for Trump’s 2020 campaign, also suggested the Ukraine controversy is really about Biden in an email sent to Yahoo News on Tuesday morning, hours before Pelosi’s announcement. Murtaugh argued that Democrats are trying to exploit a “Biden scandal” because they have “wanted to overturn the legitimate results of the 2016 election ever since President Trump was elected.” “They’ve always wanted to impeach him, and they’ve just been shopping around for an excuse,” Murtaugh said. These comments from top Trump staffers encapsulate the three major elements of the president’s emerging impeachment playbook: predicting the effort will backfire on Democrats, arguing the opposition has wanted to oust Trump from the moment he was elected and trying to shift the focus on Biden. Concerns about Trump’s interactions with Zelensky mounted in recent weeks following the news that an official filed a whistleblower complaint that included Trump’s call with the Ukrainian leader. The director of national intelligence has not yet forwarded the full complaint to Congress. As details of the call came out, Democrats and other critics said Trump was improperly asking a foreign country to interfere in next year’s presidential election by raising questions about the Biden family. After news of that complaint became public, the Washington Post reported that Trump asked that military assistance to Ukraine be delayed. Commercial arms sales to the country were also held up during the past year and the State Department hasn’t turned over required reports documenting those sales to Congress. In the transcript of the call with Zelensky that was released by the White House, Trump asked the Ukrainian president to work with the U.S. attorney general and Giuliani on a potential Biden probe shortly after discussing U.S. support for Ukraine. Trump noted the United States had been “very good to Ukraine” before bringing up Hunter Biden and the fired prosecutor. “There's a lot of talk about Biden’s son, that Biden stopped the prosecution and a lot of people want to find out about that,” Trump said, adding, “If you can look into it ... it sounds horrible to me.” Following the release of the transcript, the White House accidentally sent out talking points meant for Republican lawmakers to Democrats. The talking points argued “the transcript clearly shows there was no quid pro quo or anything else inappropriate about the conversation between President Trump and President Zelensky.” In the talking points, the White House also made the case it is “appropriate” for Trump to suggest the possibility Biden “used his official position to derail an investigation in another country” should “be looked into.” Earlier this week, as the controversy over Ukraine intensified, one source close to the president admitted the call with Zelensky could have hurt Trump. However, they predicted the Democrats were unlikely to launch an impeachment effort. Even after Pelosi announced the opening of a formal impeachment inquiry, the source was unfazed. “Trump is like Rocky Balboa. He can take the punches better than anyone and counterpunch,” the source said. “He’ll absorb these hits and see Biden further collapse.” Regardless of impeachment proceedings, Trump will continue to press Biden on Ukraine. While there has been no evidence Biden or his son engaged in wrongdoing, some critics have said it was unseemly for Hunter Biden, who had little relevant experience, to have a highly paid role on the board of a Ukrainian company as his father led U.S. diplomatic efforts in that country. The source close to the president argued coverage of the ongoing scandal will present Trump an opportunity to highlight these questions and hurt Biden in the Democratic presidential primary. “They dropped a nuclear bomb on working-class Joe Biden by painting him as corporate-class Joe Biden,” the source said. “That’s a fundamental problem when he’s losing ground to Elizabeth Warren, who has this anticorporate message.” The Biden campaign has aggressively fought back against efforts by Trump and his allies to accuse the former vice president of impropriety. Biden scheduled a press conference in his home state of Delaware on Tuesday afternoon to address the Ukraine scandal. “I knew when I decided to run, this president would attack me and anyone else he thought would be a threat to his winning. … Even though every reputable publication has looked at the charge that has been made against me and found them baseless and untrue and without merit, that’s not about to stop him,” Biden said of Trump. A Biden supporter also dismissed the notion there’s any valid comparison between the business dealings of the former vice president’s family and questions about Trump’s Russian ties. “A 787 Dreamliner and a pineapple are also the same thing,” the Biden supporter quipped. While the Ukraine scandal was the impetus for Democratic leadership to open a formal impeachment inquiry, some members of the opposition party were pushing for Trump to be impeached well before this latest issue emerged. Many Democrats have argued the evidence collected by former special counsel Robert Mueller showed impeachable offenses, including potential obstruction of justice by Trump. The Trump campaign, for its part, is arguing that impeachment was always the Democrats’ game plane. After Pelosi announced the impeachment inquiry on Tuesday, Murtaugh, the Trump campaign’s communications director, pointed to a video the president posted on his Twitter page, one of several rapid responses to impeachment from Trump’s team, showing earlier calls for impeachment and describing it as the Democrats’ “sole focus.” “We’ve had that [clip] ready for weeks in case the Dems were that stupid. And they were,” Murtaugh said. The Trump campaign also sent out a fundraising pitch to supporters within an hour of Pelosi’s remarks. The message asked supporters to give $45 to join. “Get on the list of Patriots … ALL DONATIONS DOUBLE-MATCHED,” the message said. _____ Download the Yahoo News app to customize your experience. Read more from Yahoo News: Military ammunition sale to Ukraine faces year-long delay Russia carried out a 'stunning' breach of FBI communications system Intelligence whistleblowers face a dangerous path to Congress After hours of questioning Lewandowski, Democrats finally land punches 360: Can youth activists inspire climate change action? PHOTOS: Scientists race to read Austria's melting climate archive"
13,rudy-giuliani-calls-fellow-fox-173257202.html,Rudy Giuliani calls fellow Fox News guest a serial liar and a moron,"Wed, 25 Sep 2019 13:32:57 -0400","Rudy Giuliani hurled abuse at a fellow Fox News guest, calling him a “serial liar” and a “moron” as the president’s opponents pledged to seek Donald Trump’s removal from office.",https://news.yahoo.com/rudy-giuliani-calls-fellow-fox-173257202.html,"Rudy Giuliani hurled abuse at a fellow Fox News guest, calling him a “serial liar” and a “moron” as the president’s opponents pledged to seek Donald Trump’s removal from office."
14,high-schools-decision-turn-away-172708212.html,"High schools decision to turn away girls at dance over dress code is a sexism issue, parents say","Tue, 24 Sep 2019 13:27:08 -0400",A Kentucky high school is under fire after it turned away dozens of girls at a homecoming dance for wearing what it perceived were short dresses.,https://news.yahoo.com/high-schools-decision-turn-away-172708212.html,"A Kentucky high school is under fire after it turned away dozens of girls at a homecoming dance for wearing what it perceived were short dresses, the Louisville Courier Journal reports.  Last Saturday, the staff at Eastern High School in Louisville reportedly used rulers to measure each girl's hem to see how high it was above the knees. The school had earlier sent a letter listing the dress code rules, one of which required that dresses be no more than two inches above the top of the knee.  Upon determining that the girls' dresses did not meet that requirement last weekend, school officials allegedly refused to admit them to the dance. Following the incident, one of the girls, an unidentified 15-year-old, admitted to the newspaper that ""it just made me feel awful about myself like I wasn't acceptable."" Her mother Carrie Vittitoe agreed, calling the school's policy a ""sexism issue."" That same day, another parent took to Twitter to voice her anger.  ""Wondering why Eastern High School insulted young girls by MEASURING THEIR DRESSES WITH A RULER AS THEY ENTERED HOMECOMING DANCE??"" wrote Emily Burrice. ""These beautiful girls were not admitted."" @mandy_mclaren@JCPSSuper Wondering why Eastern High School insulted young girls by MEASURING THEIR DRESSES WITH A RULER AS THEY ENTERED HOMECOMING DANCE?? These beautiful girls were not admitted #insulting#doublestandardpic.twitter.com/K9bVWVgRrO Burrice's tweet was met with support from other Twitter users, many of whom criticized the school for taking things too far.  ""Eastern High School reeks of misogyny and sexism,"" one person wrote.  ""Seriously?!?"" another replied. ""I was in charge of homecoming for 8 years at the school where I work and NOT ONCE did we send a student away for what they were wearing. That’s crazy!"" Eastern has also since been accused by other parents for inconsistently enforcing the dress code.  ""I have two daughters who attend Eastern,"" Lori Chitwood said in an email to the Courier Journal. ""One was admitted, and one was not. It actually ruined my oldest daughter's homecoming.""  In response to the backlash, a spokeswoman for Jefferson County Public Schools (JCPS), which oversees Eastern High School, said on Monday that it would review its policies.  ""Student representatives and parent representatives will review the dress code as well, along with a teacher group, and administrators will work with their (school-based decision-making council) to consider suggestions for improvement,"" Renee Murphy said.  In a letter obtained by the newspaper, Eastern High School Principal Lana Kaelin also addressed last week's episode with both students and parents.  ""I understand your concerns and truly regret that some of our students were not able to enjoy their evening,"" she wrote. ""Understandably, we had students and families who were upset or hurt by what took place, and for that I apologize."""
15,rare-painting-possibly-worth-millions-142930560.html,"Rare painting, possibly worth millions, was just hanging in womans kitchen, experts say","Tue, 24 Sep 2019 10:29:30 -0400","""Christ Mocked,"" a work by the 13th century pre-Renaissance painter Cimabue was found in a house in northern France, art auctioneers say.",https://news.yahoo.com/rare-painting-possibly-worth-millions-142930560.html,"A rare painting from the Italian master Cimabue was found hanging in the kitchen of a woman outside Paris, local media reported. ""Christ Mocked,"" a work by the 13th century pre-Renaissance painter, was part of a larger display and could be valued between $4.4 to 6.6 million, art expert Éric Turquin told French newspaper Le Figaro. The painting was found in the town of Compiègne after an auctioneer saw the work, which the woman had hung directly above a hotplate, and told her to have it appraised, said Stephane Pinta, a painting specialist with the Turquin gallery in Paris. The woman had thought the work was just an old religious work, the French news agency AFP reported. The painting, about 8 inches by 11 inches, was part of a diptych that was broken up and included eight scenes from the Passsion of the Christ, Le Figaro reported. Two other sections, painted around 1280, are displayed at the Frick Collection in New York and the National Gallery in London. 'Indiana Jones of art': $28 million Picasso, stolen 20 years ago, recovered Turquin told the AFP that art historians used infrared light to analyze the work and determined that there was ""no disputing that the painting was done by the same hand"" as Cimabue's other work. The painting is slated to be auctioned Oct. 27 at the Acteon auction house in Senlis, France. According to Le Figaro, none of Cimabue's paintings have ever been auctioned.  The Florentine painter, also known as Cenni di Pepo, was hugely influential just before the Italian Renaissance began, and art journal The Art Newspaper described him as ""the father of Western painting."" Contributing: The Associated Press. Follow USA TODAY's Ryan Miller on Twitter @RyanW_Miller This article originally appeared on USA TODAY: Cimabue painting 'Christ Mocked' found in woman's kitchen in France"
16,district-attorney-plans-california-store-173042615.html,Off-duty officer wont be charged in deadly Costco shooting,"Wed, 25 Sep 2019 19:36:24 -0400","An off-duty Los Angeles police officer will not be charged for fatally shooting a mentally ill man who had attacked him and his young son from behind in a California Costco, prosecutors said Wednesday.  In announcing a grand jury's findings, Riverside County District Attorney Mike Hestrin said Officer Salvador Sanchez believed he had been shot in the head and a shooter was on the loose when he and his son were knocked to the ground in the unprovoked assault.  Hestrin said his office would not bring its own charges against Sanchez in the wake of the grand jury decision.",https://news.yahoo.com/district-attorney-plans-california-store-173042615.html,"LOS ANGELES (AP) — An off-duty Los Angeles police officer will not be charged for fatally shooting a mentally ill man who had attacked him and his young son from behind in a California Costco, prosecutors said Wednesday. In announcing a grand jury's findings, Riverside County District Attorney Mike Hestrin said Officer Salvador Sanchez believed he had been shot in the head and a shooter was on the loose when he and his son were knocked to the ground in the unprovoked assault. Hestrin said his office would not bring its own charges against Sanchez in the wake of the grand jury decision. Sanchez, a seven-year veteran of the LAPD, opened fire June 14, killing 32-year-old Kenneth French and critically injuring his parents, Russell and Paola French. ""In a case like this, it's appropriate for the community to weigh in,"" Hestrin said at a news conference about the grand jury deliberations. ""This case has weighed heavily on us."" Dale Galipo, an attorney for the French family, said he was ""disappointed but not surprised"" by the development. He said he believes prosecutors only took the case to a grand jury to appease the community and may not have pushed hard enough to persuade the jurors. Ira Salzman, Sanchez's lawyer, said his client was ""gratified"" to hear he won't be charged. Salzman said Sanchez did not testify before the grand jury but had given evidence to the district attorney's office regarding his state of mind and subsequent medical records showing a concussion. ""Sal believed he was shot,"" Salzman said. ""The case was a terrible tragedy."" The officer remains on paid administrative leave as the LAPD conducts an inquiry into whether Sanchez followed department policies. The encounter in the Corona warehouse store spanned just 3.8 seconds. Investigators relied on a single, poor-quality surveillance video and witness testimony — some of which had to be compelled through subpoenas. Sanchez, holding his 1½-year-old son, was standing in line for food samples with his wife when French, without warning or provocation, knocked Sanchez and the child to the ground. Seconds later, prosecutors said, Sanchez fired 10 rounds from his handgun, believing his life and his son's life were in immediate danger from an active shooter. Four bullets struck French in the back and shoulder, one struck his mother in the stomach and another hit his father in the back, Corona police Chief George Johnstone said. The gunfire prompted chaos inside the warehouse as terrified shoppers rushed to leave while police officers — who also believed there was an active shooter — ran inside. Witnesses reported seeing Sanchez reach to the back of his head multiple times to look for blood, Hestrin said, noting that Sanchez's claim of being knocked unconscious was not supported by any evidence. Galipo has said Russell and Paola French were trying to explain to the officer that his son had a mental disability when shots rang out. French, of Riverside, had been taken off his medication because of other health complications, which may have affected his behavior that night, Galipo has said. The family has filed a claim — a precursor to a lawsuit — against Sanchez and the Los Angeles Police Department. Galipo said he plans to file a federal lawsuit within the next month. ___ Associated Press Writer John Antczak contributed to this story."
