,id,title,date,description,link,full text
34,dad-faces-sentencing-paying-250k-103333460.html,LA businessman sentenced to 4 months in prison for paying $250K to get son into USC as water polo recruit,"Wed, 25 Sep 2019 09:38:45 -0400","Devin Sloane, a Los Angles business executive, is the second parent sentenced in the nation's college admissions scandal.",https://news.yahoo.com/dad-faces-sentencing-paying-250k-103333460.html,"BOSTON – Devin Sloane, a Los Angles business executive, was sentenced Tuesday to four months in prison for paying $250,000 to get his son accepted into the University of Southern California as a fake water polo recruit.  He is the second parent to be sentenced in Boston federal court in the nation's college admissions scandal after actress Felicity Huffman received 14 days in prison this month. U.S. District Judge Indira Talwani also sentenced Sloane to two years of supervised release, 500 hours of community service and a $95,000 fine.  ""Just because you’re a good person doesn’t mean you don’t commit a crime when you do those things,"" Talwani said. “I come back to the action you took in bribing a college official. Bribing a college official is a serious crime. You are not a repeat player, but what you did involved your child."" Sloane, 53, is the founder and CEO of waterTALENT, a water treatment company. The judge ordered him to report to prison Dec. 3.  Sloane and his team of attorneys declined to comment leaving the courthouse.  The longer prison term for Sloane compared to Huffman means parents who took part in the recruitment plot rather than the testing scam could be in line for tougher sentences. Parents made larger payments to Rick Singer, the admissions scheme's mastermind, to participate in the recruitment plot, which guaranteed a seat at a college or university. Federal prosecutors had recommended that Sloane receive one year and a day in prison in addition to a $75,000 fine and 12 months of supervised release. Sloane's lawyers said he should be sentenced to 2,000 hours of community service instead of prison and proposed he launch and oversee a Special Olympics initiative at independent schools.    The judge rejected that idea, noting that Sloane has an exemplary record of community service. ""I think those are very good characteristics,"" she said. ""But I don’t understand how it’s punitive.""  ""I don’t think that independent school children is the focus of this case,"" Talwani said when Sloane's lead attorney, Nathan Hochman, suggested the proposal could be a way to help students harmed in the college admission case. ""That’s about as tone-deaf as I’ve heard."" .oembed-frame {width:100%;height:100%;margin:0;border:0;} California businessman Devin Sloane and his attorneys declined to comment to reporters after he was sentenced just now to 4 months in prison for paying $250K go get his son accepted into @USC as a fake water polo recruit. pic.twitter.com/VZ61r4kAjz More: What Felicity Huffman's prison sentence means for other parents in college admissions scandal In a deal with prosecutors, Sloane pleaded guilty in May to conspiracy to commit mail fraud and honest services mail fraud.  Sloane choked up addressing the judge Tuesday and apologized to his family and the judge. “There are no words to justify my behavior,"" he said, adding that he takes ""complete responsibility"" for his actions. ""Some people see this as a case of privilege and arrogance. In my heart and soul, I wanted what was best for my son. I now realize this was the antitheses of that."" But Talwani pushed back, making a statement about the entire admissions scandal.  “I find that’s at issue in all of these cases. It’s not basic care-taking for your child. It’s not getting your child food or clothing. It’s not even getting your child an education. It’s getting your child into a college that you call ‘exclusive.’” ""Are they doing this for their children or their own status?” Assistant U.S. Attorney Eric Rosen argued Sloane’s conduct was “far more egregious” than Huffman’s, noting he paid “17 times the bribe amount” to Singer. Rosen argued Sloane did not accept responsibility like Huffman did.   “Huffman has owned her criminal activity, while the defendant attacked the victim and blamed others,” Rosen said. He argued Sloane's proposal for significant community service would not be available to the poor and middle class.    “Make no mistake, he is using his wealth to attempt to buy his way out of jail,” Rosen said. “Prison is necessary here as a great leveler between rich and poor, and that’s why the defendant is doing everything possible here to avoid it.” According to prosecutors, Sloane paid $200,000 to Singer's sham nonprofit group, the Key Worldwide Foundation, and $50,000 to USC Women's Athletics through Donna Heinel, a former senior associate athletic director at USC, who has pleaded not guilty to charges. The payments came in 2017 and 2018 after Sloane's son was fraudulently admitted to USC as an internationally accomplished water polo recruit – which he was not.  Hochman told the judge Sloane was a ""good man who made a mistake"" and that 2,000 hours of community service would be unprecedented, making it an appropriate punishment instead of prison. But Talwani interjected at several moments to disagree with his defense, including when Hochman disputed that Sloane knew Heinel received bribe money. He said his client did not know what Singer did with the money.   “Your client didn’t know how the messy details were being worked out,"" Talwani said. ""But he understood the money was being used to bribe a USC official."" Hochman painted Singer as a ""world-class scheme and manipulator"" and suggested that Sloane would not have committed the crime if not for Singer. That also drew sharp disagreement from the judge. ""Why is that the question?"" Talwani said, noting that she has defendants come before her court regularly who have been offered a “financial route” to sell drugs or commit other crimes. “Why does it matter that somebody invited him?” Fifty-two defendants, including 35 parents, were charged with crimes in the nation's ""Varsity Blues"" college admissions scheme. Twenty-three defendants pleaded guilty to felonies; the remaining pleaded not guilty. The government has pushed for longer prison terms for parents, such as Sloane, who made among the largest payments in the scheme. In contrast, Huffman paid $15,000 to have someone correct answers on the SAT exam for her oldest daughter. Prosecutors sought one month of prison for Huffman. More: Felicity Huffman sentenced: 2 weeks in prison, $30,000 fine for college admissions scandal A ruling earlier this month from Talwani on which federal sentencing guidelines to use might have led to a lighter prison term than prosecutors had sought for Sloane. The judge decided the federal fraud statute should set the base level for sentences of parents in the admissions case. The government requested the tougher commercial bribery statue to apply. More: Felicity Huffman is just the beginning: Who's pleaded guilty in the college admissions scandal – and who's still fighting The college admissions case continues Thursday in Boston federal court when Stephen Semprevivo, a former executive at Cydcor, is scheduled to be sentenced. Semprevivo admitted paying $400,000 for his son to be admitted into Georgetown University as a fake tennis recruit. Semprevivo's legal team watched Sloane's hearing from inside the courtroom. Reach Joey Garrison on Twitter @joeygarrison. This article originally appeared on USA TODAY: Dad receives 4 months in prison for paying $250K to get son into USC"
35,fbi-agents-illinois-capitol-law-180602449.html,"FBI agents raid Illinois state senators home, offices","Tue, 24 Sep 2019 15:52:34 -0400","FBI agents carried materials in bankers' boxes and grocery bags out of the Illinois Capitol building on Tuesday, and multiple media outlets reported that and other raids were linked to a Democratic state senator. FBI spokesman John Althen said the agents were in the building for ""law enforcement activity"" but declined to elaborate. Multiple media outlets reported that the raids were conducted at Sen. Martin Sandoval's Capitol office in Springfield, his district office in the Chicago suburb of Cicero and his Chicago home.",https://news.yahoo.com/fbi-agents-illinois-capitol-law-180602449.html,"SPRINGFIELD, Ill. (AP) â€” FBI agents carried materials in bankers' boxes and grocery bags out of the Illinois Capitol building on Tuesday, and multiple media outlets reported that and other raids were linked to a Democratic state senator. FBI spokesman John Althen said the agents were in the building for ""law enforcement activity"" but declined to elaborate. Multiple media outlets reported that the raids were conducted at Sen. Martin Sandoval's Capitol office in Springfield, his district office in the Chicago suburb of Cicero and his Chicago home. The Chicago Tribune reported that a man who answered the door at Sandoval's home said he was not home. The suite door to Sandoval's office would not open when an Associated Press reporter tried to enter at around the time the raid was taking place. Attempts to reach Sandoval by phone were unsuccessful. Several men in dark suits and ties could be seen walking from the Senate Democrats' side of the Capitol, carrying the bags and boxes of materials. The word ""evidence"" could be seen written across at least one of the bags. Photos from some media outlets also showed people carrying boxes from his home. Sandoval, 55, has served in the Senate since 2003, representing a district on Chicago's southwest side. He is chairman of the powerful Transportation Committee and was a driving force behind a 19-cents-a-gallon increase in the gas tax to help fund Democratic Gov. J.B. Pritzker's $45 billion capital construction plan to rebuild roads, bridges and schools. Republicans criticized him in August when a photo from a fundraiser appeared on social media showing what appeared to be a mock assassination of President Donald Trump. Sandoval later said neither he nor his staff was aware that an entertainment vendor had a beverage dispenser shaped like a rifle and pointed it at someone wearing a Trump mask. He expressed ""my deepest regret that this unfortunate incident took place at (an) event in my name."" It wasn't clear whether Sandoval's work on the gas tax plan or his fundraiser had anything to do with the raids. Federal prosecutors in Illinois have brought several high-profile corruption cases this year. In August, state Sen. Thomas E. Cullerton pleaded not guilty in Chicago federal court to charges that he took more than $250,000 in salary and benefits over a three-year period from the Teamsters while allegedly doing little or no work. ___ Tarm reported from Chicago. ___ This story has been corrected to show that the gas tax was increased 19 cents, not 18 cents."
36,israels-president-asks-netanyahu-try-171753846.html,Netanyahu tapped by Israels president to form new government,"Wed, 25 Sep 2019 13:17:53 -0400","Israel's president tasked Prime Minister Benjamin Netanyahu on Wednesday with assembling a new government after power-sharing talks with his strongest rival, Benny Gantz, failed following an inconclusive election.  Accepting the mandate from President Reuven Rivlin at a televised ceremony, a politically weakened Netanyahu said his chances of success were only marginally higher than those of Gantz, a former general who heads the Blue and White party.  In his remarks, Netanyahu seemed to envision a scenario in which he and Gantz would be able to take another stab at power-sharing once it became clear there was no way out of the current deadlock, save for a third election that few in Israel wanted.",https://news.yahoo.com/israels-president-asks-netanyahu-try-171753846.html,"By Jeffrey Heller JERUSALEM (Reuters) - Israel's president tasked Prime Minister Benjamin Netanyahu on Wednesday with assembling a new government after power-sharing talks with his strongest rival, Benny Gantz, failed following an inconclusive election. But right-wing Likud party chief Netanyahu, facing a looming indictment on corruption allegations he denies, still has no clear path to a fifth term after emerging from the Sept. 17 ballot, the second this year, short of a parliamentary majority. Accepting the mandate from President Reuven Rivlin at a televised ceremony, a politically weakened Netanyahu said his chances of success were only marginally higher than those of Gantz, a former general who heads the Blue and White party. In his remarks, Netanyahu seemed to envision a scenario in which he and Gantz would be able to take another stab at power-sharing once it became clear there was no way out of the current deadlock, save for a third election that few in Israel wanted. ""If I don't succeed, I will return the mandate to you and with the help of God and Israel's citizens and yourself, Mr President, we will establish a broad national unity government down the line,"" he said. Netanyahu, 69 and Israel's longest-serving leader, will have 28 days to form a coalition and can ask Rivlin for a two-week extension if necessary. Netanyahu's failure to clinch victory in a ballot in April led to last week's election. Rivlin, in his remarks, pointedly noted that he is under no obligation to grant his prime minister-designate that two-week extension to establish a governing coalition. Nor did he commit to turning to Gantz if Netanyahu failed to break the current deadlock. Under law, Rivlin can assign the coalition-building task to any member of parliament he deems likely to succeed, or he can ask the legislature to pick someone. With final results announced on Wednesday, Likud has the pledged support of 55 legislators in the 120-member parliament, against 54 for Blue and White. The two parties failed to reach a coalition deal in talks launched on Tuesday. Former Defence Minister Avigdor Lieberman, a possible kingmaker, has been keeping his far-right Yisrael Beitenu party on the fence since the Sept. 17 ballot, citing differences with Likud's ultra-Orthodox religious partners and Blue and White's left-wing allies. ""It became clear that neither Netanyahu nor Gantz had the 61 seats necessary to form a government,"" Rivlin said at the ceremony. ""Netanyahu's ability to assemble an administration is higher at the moment,"" the president said, noting that 10 Arab legislators in Gantz's support bloc of 54, who recommended he nominate the ex-general, did not commit to joining a government. Rivlin had until next Wednesday to announce his choice, but the Likud-Blue and White unity talks showed no sign of progress. A deal in which Netanyahu and Gantz would take turns as prime minister was widely mooted. But in his campaign, Gantz pledged not serve in a government with Netanyahu, citing the Israeli leader's legal troubles. And Gantz's deputies in Blue and White also voiced their strong opposition while the unity talks were under way. Next month, Israel’s attorney-general will hold a pre-trial hearing on his announced intention to indict the Israeli leader on fraud and bribery charges in three corruption cases. Netanyahu, who says he is a victim of a political witch-hunt, can argue at the session against being charged. As prime minister, Netanyahu would be under no legal obligation to resign if formal charges were filed. But any other cabinet post might not offer him that protection.  (Editing by Alex Richardson)"
37,heres-us-air-force-planned-185620085.html,Heres what the US Air Force has planned for all its bombers,"Wed, 25 Sep 2019 14:56:20 -0400","From the venerable B-52 to the future B-21, the US leads the way in firepower and stealth technology. This is what the US has in the skies.",https://news.yahoo.com/heres-us-air-force-planned-185620085.html,"REUTERS/Cherie A. Thurlby/U.S. Air Force CAT/GN  The US has three bombers — the B-1B Lancer, the stealth B-2 Spirit, and the B-52 Stratofortress — to deliver thousands of tons of firepower in combat. Some form of the B-52 has been in use since 1955. The B-1B took its first flight in 1974, and the B-2 celebrated its 30th year in the skies in 2019. A new stealth bomber, the B-21, is in production and is expected to fly in December 2021, although details about it are scarce. The US Air Force has been conducting missions in Europe with B-52s and B-2s in order to project dominance against Russia and train with NATO partners, but the bomber fleet has faced problems. The B-1B fleet struggled with low readiness rates, as Air Force Times reported in June, likely due to its age and overuse in recent conflicts. Here are all the bombers in the US Air Force's fleet. US Air Force The Lancer is a long-range, multi-role heavy bomber and has been in service since 1985, although its predecessor, the B-1A, was developed in the 1970s as a replacement for the B-52. The B-1B is built by Boeing and has a payload of 90,000 pounds. The Air Force is also looking at ways to expand that payload to carry more weapons and heavier weapons, including hypersonics. The Lancer has a wingspan of 137 feet, a ceiling of 30,000 feet, and can hit speeds up to Mach 1.2, according to the Air Force. There are 62 B-1Bs currently in service.  US Air Force/Staff Sgt. Peter Reft The B-1B is not scheduled to retire until 2036, but constant deployments to the Middle East between 2006 and 2016 ""broke"" the fleet. Service officials and policymakers are now considering whether the Lancer can be kept flying missions, when it should retire, and what that means for the bomber fleet as a whole.  U.S. Air Force/Master Sgt. Ralph Hallmon/AP The Air Force's longest-serving bomber came into service in 1955 as the B-52A. The Air Force now flies the B-52H Stratofortress, which arrived in 1961. It has flown missions in Iraq during Operation Desert Storm and during operations against ISIS. The B-52H Stratofortress can carry a 70,000 pound payload, including up to 20 air-launched cruise missiles, and can fly at 650 mph. It also recently dropped laser-guided bombs for the first time in a decade. The Stratofortress is expected to be in service through 2050, and the Air Force has several upgrades planned, including new engines, a new radar, and a new nuclear weapon.  Edwards Air Force Base Two B-52s have returned to service from 309th Aerospace Maintenance and Regeneration Group (AMARG) at Davis-Monthan Air Force Base in Arizona, also known as the ""boneyard,"" where retired or mothballed aircraft are stored. One bomber, nicknamed ""Ghost Rider"" returned in 2015, and the other, ""Wise Guy,"" in May. ""Wise Guy,"" a Stratofortress brought to Barksdale Air Force Bease in Louisiana to be refurbished, had a note scribbled in its cockpit, calling the aircraft, ""a cold warrior that stood sentinel over America from the darkest days of the Cold War to the global fight against terror"" and instructing the AMARG to ""take good care of her … until we need her again.""  Wikimedia Commons The B-2 was developed in a shroud of secrecy by Northrop Grumman. It is a multi-role bomber, capable of delivering both conventional and nuclear munitions. It has a payload of 40,000 pounds and has been in operational use since 1993. July was the 30th anniversary of the B-2's first flight, and the Air Force currently has 20 of them.  US Air Force/Tech. Sgt. Matthew Plew The B-2 operates out of Whiteman Air Force Base in Missouri, and three of the bombers are currently flying out of RAF Fairford in the UK. From Fairford, the B-2 has completed several firsts this year — the first time training with non-US F-35s, its first visit to Iceland, and its first extended flight over the Arctic.  US Air Force What we do know: It will be a stealth aircraft capable of carrying nuclear and conventional weapons. Built by Northrop Grumman, the B-21 is named for Doolittle's Raiders, the crews who flew a daring bomb raid on Japan just a few months after the attack on Pearl Harbor.  The Air Force said last year that B-21s would go to three bases when they start arriving in the mid-2020s: Dyess Air Force Base in Texas, Ellsworth Air Force Base in South Dakota, and Whiteman Air Force Base in Missouri.  Northrup Grumman Air Force Vice Chief of Staff Gen. Stephen Wilson said on July 24 that he has an application on his phone ""counting down the days … and don't hold me to it, but it's something like 863 days to first flight,"" according to Air Force Magazine. The B-21 also loomed over the B-2's 30th anniversary celebrations at Northrop's facility in Palmdale, California, where the B-2 was built and first flew.  Company officials have said work on the B-2 is informing the B-21's development, and recently constructed buildings at Northrop's Site 7 are thought to be linked to the B-21.   "
38,toilet-controversy-indias-modi-ignores-protests-collect-gates-012010036.html,Toilet controversy: Indias Modi ignores protests to collect Gates award,"Tue, 24 Sep 2019 21:20:10 -0400","Indian Prime Minister Narendra Modi on Tuesday brushed aside an outcry from human rights activists to receive an award from the Gates Foundation in New York for his efforts to end open defecation.  The decision to honor the Indian leader provoked several withering op-eds and the ire of three Nobel prize winners, citing rising attacks against minorities under Modi's tenure, while British-Asian actors Jameela Jamil and Riz Ahmed who had been due to attend dropped out.  The Bill and Melinda Gates Foundation said it respected the critics' views but defended its decision, saying sanitation is a neglected issue and India's program can serve as a model for other countries.",https://news.yahoo.com/toilet-controversy-indias-modi-ignores-protests-collect-gates-012010036.html,"New York (AFP) - Indian Prime Minister Narendra Modi on Tuesday brushed aside an outcry from human rights activists to receive an award from the Gates Foundation in New York for his efforts to end open defecation. The decision to honor the Indian leader provoked several withering op-eds and the ire of three Nobel prize winners, citing rising attacks against minorities under Modi's tenure, while British-Asian actors Jameela Jamil and Riz Ahmed who had been due to attend dropped out. The Bill and Melinda Gates Foundation said it respected the critics' views but defended its decision, saying sanitation is a neglected issue and India's program can serve as a model for other countries. ""I dedicate this award to all those Indians who transformed the 'Clean India Mission' into a people's movement and started giving cleanliness the highest priority in their daily lives,"" Modi said after collecting the award from billionaire philanthropist and Microsoft founder Bill Gates. India's government says it has built more than 100 million toilets under a $20 billion initiative begun in 2014 to address the issue of open defecation, particularly in rural areas, a major public health issue in the country. Under Modi's plan, tribal households get $200 each for building latrines. But ahead of the ceremony, Nobel Peace Prize winners Mairead Maguire, Tawakkol Abdel-Salam Karman and Shirin Ebadi said that under Modi's leadership, ""India has descended into dangerous and deadly chaos that has consistently undermined human rights, democracy. ""This is particularly troubling to us as the stated mission of your foundation is to preserve life and fight inequity,"" they wrote, urging the Gates Foundation to change its decision. In addition to a rise in mob lynchings of Muslims, Christians, and Dalits, they noted the decision by Genocide Watch to issue warnings for the state of Assam and Indian-administered Kashmir. The disputed territory is under a communications blackout that has lasted 50 days after Modi rescinded its autonomy. The award was also protested in an online petition that garnered 100,000 signatures as well as a comment piece co-authored by feminist leader Gloria Steinem. Modi won a second term in a huge election victory in May and drew tens of thousands of diaspora fans on Sunday in an unusual joint rally in Houston with President Donald Trump. He did not respond to the criticism over the award. The Gates Foundation told AFP in a statement: ""Before the Swachh Bharat mission, over 500 million people in India did not have access to safe sanitation, and now, the majority do. ""The Swachh Bharat Mission can serve as a model for other countries around the world that urgently need to improve access to sanitation for the world's poorest."""
