,id,title,date,description,link,full text
0,senator-elizabeth-warrens-net-worth-151126747.html,Senator Elizabeth Warrens net worth revealed as the 2020 Presidential Election heats up,"Tue, 24 Sep 2019 11:11:26 -0400","The 2020 President Election is heating up -- and with taxes and finances being some of the biggest areas, here's a look at Sen Elizabeth Warren's net worth.",https://news.yahoo.com/senator-elizabeth-warrens-net-worth-151126747.html,"The 2020 presidential race is well underway, and while some of the early hopefuls have dropped their bids, there are still a handful of Democratic contenders looking to land on the official ballot.  One of the more prominent candidates, Senator Elizabeth Warren, is putting a lot of effort behind her 2020 bid.  Warren, who is currently a U.S. Senator in Massachusetts, is regarded as one of the more liberal candidates in the current Democratic race. The senator has built her campaign on promising middle-class Americans to fight for their equality.  “Rich guys have been waging class warfare against hard-working people for decades ,” Warren said in her speech announcing her candidacy for president. “ I say it’s time to fight back!”  READ MORE: Bill de Blasio's net worth as he pulls out of the 2020 presidential race  In February, the senator filed personal financial disclosures for her candidacy which were obtained by The Center for Public Integrity and later revealed on Twitter.  2/ pic.twitter.com/brc938IPZ3 According to the documents, Warren amassed a majority of her wealth from bond and mutual funds -- as well as retirement accounts and book royalties. The politician and former lawyer, along with her husband, also have two real estate properties: a $3 million Victorian in Cambridge, Massachusetts, and an $800,000 condo in Washington, D.C. Forbes reported the presidential hopeful is worth an estimated $12 million.  "
1,bill-oreilly-says-book-trump-162056672.html,Bill OReilly says new book on Trump will bring backlash: This is his actual life history,"Tue, 24 Sep 2019 12:20:56 -0400","Former Fox News host Bill O'Reilly latest book,'The United States of Trump,' is all about the sitting president.",https://news.yahoo.com/bill-oreilly-says-book-trump-162056672.html,"Bill O'Reilly says his new book is the first telling of President Trump's ""actual life history."" The former Fox News giant, who declared himself ""the biggest nonfiction author in history,"" recently released ""The United States of Trump: How the President Really Sees America,"" which is already a No. 1 best-seller on Amazon. O'Reilly says that researched the 320-page tome himself, telling Page Six's Cindy Adams that he got several new first-hand accounts of people that have been around Trump at some point in his life. ""Nothing anonymous. All primary sources. Eye witnesses,"" he said. ""Every comment confirmed and authorized. People who’d been present or dug out confirmation. [...] This is his actual life history."" ""This fact-based account of a sitting president, in our lifetime, as history unfolds, will bring backlash,"" O'Reilly went on. ""My book’s neither pro nor con. Every word true. I sent it to him and will probably hear from him at his usual 2 AM.""  ""The United States of Trump: How the President Really Sees America"" by Bill O'Reilly ($16.80)  ""The United States of Trump: How the President Really Sees America"" by Bill O'Reilly ($16.80) The conservative TV personality promises that ""The United States of Trump"" will address Trump's ""complicated"" relationship with his children, ""about not serving in Vietnam"" and his ancestral history. ""The president mightn't like info such as his German grandfather in the flesh business,"" O'Reilly teased. As for his current feelings on the United States' divisive leader, the disgraced Fox News host called him ""brilliant."" ""USA won’t admit he’s brilliant and five steps ahead of most. Nobody could do what he did, hardscrabble, and get elected. He knows America’s feelings and how to market it. Not luck,"" he told Page Six. ""Look, I just got fed up. Ninety percent of what’s reported is nonsense. He’s no second Messiah -- and who knows what he’ll do? -- but I will say the Democrats are helping him out."" ""He has tenacity, perseverance. His flaw? Self-discipline,"" he went on. ""And defeating his own purpose is dumb. Who cares that he doesn’t like John Bolton? Instead of screaming the Democrats are Socialists, he’s tweeting about CNN’s corruption. But there’s a good chance he’s re-elected."" Order ""The United States of Trump: How the President Really Sees America"" here. "
2,israeli-pm-rival-meet-final-110738975.html,Israels Netanyahu given chance to form new government,"Wed, 25 Sep 2019 14:46:04 -0400","Israel's president on Wednesday asked Prime Minister Benjamin Netanyahu to form a new government, giving the longtime leader the difficult task of breaking a post-election deadlock that has paralyzed the country's political system.  After a divisive campaign, Netanyahu called for a ""broad unity government"" with his chief rival former military chief Benny Gantz.  President Reuven Rivlin announced his decision late Wednesday after a second meeting aimed at brokering a unity deal between Netanyahu and Gantz ended without an agreement.",https://news.yahoo.com/israeli-pm-rival-meet-final-110738975.html,"JERUSALEM (AP) — Israel's president on Wednesday asked Prime Minister Benjamin Netanyahu to form a new government, giving the longtime leader the difficult task of breaking a post-election deadlock that has paralyzed the country's political system. After a divisive campaign, Netanyahu called for a ""broad unity government"" with his chief rival former military chief Benny Gantz. But he faces an uphill struggle, with his future clouded by a likely corruption indictment and his opponents opposed to sitting with him. President Reuven Rivlin announced his decision late Wednesday after a second meeting aimed at brokering a unity deal between Netanyahu and Gantz ended without an agreement. Standing alongside Rivlin, Netanyahu said it was clear that neither his Likud party nor Gantz's Blue and White could put together a coalition on its own, and that the only option was to band together. ""The two of us cannot form a government unless we are together,"" he said. ""The order of the moment is a unity government, a broad national unity government that is formed quickly."" He said the country faced great security challenges, highlighted by Iran, economic challenges and the ""great opportunity"" of settling its borders when President Donald Trump presents an expected Mideast peace plan. In a statement, Gantz appeared to rebuff Netanyahu, citing the Israeli leader's legal problems. ""Blue and White, led by me, does not agree to sit in a government whose leader is facing a severe indictment,"" he said. ""This issue, among a number of other critical factors, is more important to us than any delegation of ministerial posts or rotation."" Rivlin said his decision was not a solution and that both candidates were responsible for resolving the political impasse.  ""The Israeli people need to know that a government can be established,"" he said. ""It is true that everyone will have to compromise. But if a government is not formed, it is the citizens of Israel who will pay the greatest price."" Rivlin said his decision was not a solution, and that both candidates were responsible for resolving the political impasse. Although Rivlin's duties are mostly ceremonial, he is responsible for choosing the candidate he believes has the best chance of forming a coalition government. That is usually a straightforward task. But in last week's election, neither Netanyahu's Likud party nor Gantz's centrist Blue and White secured the required parliamentary majority needed to form a government. According to final official results announced Wednesday, Blue and White finished first with 33 seats in the 120-seat parliament, just ahead of Likud's 32 seats. Even with the support of smaller allies, both parties are short of the required 61-seat majority. A total of 55 lawmakers have recommended that Netanyahu lead the next government, while 54 have lined up behind Gantz. Rivlin said that after exploring all options, he concluded Netanyahu had the better chance of forming a government. Netanyahu now has a preliminary 28-day period to try to broker a deal. But his odds of success appear to be slim. Both sides agree a unity deal is the only way out of the deadlock, but they have disagreed over who should head it. Gantz has repeatedly said he will not sit with Likud as long as Netanyahu is at the helm. Facing a likely corruption indictment in the coming months, Netanyahu is desperate to remain as prime minister. Israel's attorney general has recommended charging Netanyahu with bribery, fraud and breach of trust in a series of scandals. Netanyahu, who denies any wrongdoing, is to appear at a hearing with the attorney general next week, after which a final decision on charges is expected. Legal experts say the likelihood of an indictment is high. Although Netanyahu would not be required to step down if charged, he will face heavy pressure to do so. Another key player throughout the process will be Avigdor Lieberman, whose Yisrael Beitenu party controls eight seats. Lieberman refused to endorse either candidate and is pushing for a unity government. Without a unity deal, Netanyahu will have a tough time putting together a coalition. The secular Lieberman says he will not be part of a government that includes Netanyahu's ultra-religious allies. Netanyahu now has 28 days to form a coalition, and Rivlin having discretion to give him an additional 14 days to do so. If Netanyahu fails, Gantz would likely be given an opportunity. And if that fails, a majority of parliament members could offer a third name to be prime minister. And if that fails, Israel would be forced into holding its third election in less than a year. Last week's election was triggered after Lieberman refused to join Netanyahu's coalition following April elections, citing what he said was excessive influence of religious parties. Instead of giving Gantz a chance to form a government, Netanyahu dissolved parliament and ordered a new election. Netanyahu said that if he fails this time, he will allow Rivlin to choose another candidate. ""The nation does not want another election,"" Rivlin said."
3,irans-strange-navy-small-fast-114700802.html,"Irans Strange Navy of Small, Fast Boats Is No Joke","Tue, 24 Sep 2019 07:47:00 -0400","A ""mad max"" threat?",https://news.yahoo.com/irans-strange-navy-small-fast-114700802.html,"Key point: Iran's navy could still threaten American forces, perhaps even an aircraft carrier. On May 16, 2019, U.S. officials cited reports that Iran had installed missiles on civilian motorboats in the Persian Gulf as a justification for a major deployment of U.S. military forces to the Middle East. However, this claim may ring a bit strangely to observers of Iran’s military, as employing swarms of heavily armed motor boats to launch asymmetric attacks on maritime assets has long been understood to be its naval strategy—one that Tehran hasn’t exactly been shy about publicizing. Take, for example, this video which depicts a swarm of rocket-armed boats unleashing a hail of rockets upon a giant mockup of a U.S. aircraft carrier in the Persian Gulf. Besides the rocket-armed motor boats, note also the presence of anti-ship ballistic missiles (detailed in this article) and other assets that could be cued to hit naval targets. In another ironic incident, a U.S. military diagram explaining Iranian tactics was founded and adopted by Iranian media to advertise its military strength (and was then breathlessly reported in the U.S. as a “new” Iranian threat.) The U.S. Navy even designed its Littoral Combat Ships with countering Iranian fast boats in mind—to its current regret as it re-orient to “great power” conflict. Both civil and military shipping in the Persian Gulf is exceptionally vulnerable to mines, cruise missiles and fast boat attacks because its shallow straits force large ships to squeeze through predictable lines of transit. Iran is unusual for having two navies. The older, Artesh (“regular”) Iranian Navy focuses on operating larger corvettes, frigates and missile boats, as well as over two-dozen submarines. Its area of operations is chiefly further afield in the Straits of Hormuz, the Gulf of Oman and the Indian Ocean. Its twenty-two Ghadir-class midget submarines, however, are well suited to ambush warfare in the shallow and rocky waters of the Persian Gulf. Meanwhile, the quasi-military Iranian Revolutionary Guard Corps also has its own Navy, counting over 1,500 fast boats designed to rapid swarming attacks in the shallow littoral waters of the Persian Gulf. Effectively answerable to religious hardliners rather than the head-of-state, the IRCGN has been involved in more provocative diplomatic incidents, such as the seizure of a U.S. Navy fast assault boat in January 2016. In terms of ‘civilian boats,’ the IRGCN musters hundreds of fast-in-short boats are on the pattern of the open-cabin ‘Boston Whaler’ motorboat, typically fitted with unguided rocket launchers, rocket-propelled grenades, anti-tank missiles and recoilless rifles. Other popular platforms include Swedish Boghammar motorboats and rigid-hull Zodiac inflatable rubber dinghies. These small watercraft can be based on isolated islands and oil platforms in the middle of the Persian Gulf. However, Iran also is manufacturing specialized military speed boats with more impressive capabilities. One example is the Seraj-1, reverse-engineered from a British Bladerunner 51 speed boat purchased from South Africa. Photos reveal these have been armed with a multiple-rocket-launcher system and a heavy anti-aircraft machinegun on the prow. The Seraj can reportedly attain speeds of 55 to 72 knots. The sleek, domestically-designed Zolfaghar (video here) has a maximum speed of 70 knots and mounts an integrated radar and two launch canisters for Nasr-1 cruise missiles on its stern. Based on the Chinese C704 missile, the Nasr-1 has a range of 22 miles, and can use infrared, radar or television guidance. Iranian media has also released images revealing the boat’s simple cockpit and computer displays, and an apparent mass-production line for the boats. Even more exotic watercraft includes semi-submersible boats designed to partially submerge below the water to evade detection for sabotage, special-forces insertion and spying. Finally, on the heavy end the IRGCN can deploy twenty Thondar-class fast attack boats armed (Chinese Houdong-class) with four C802 anti-ship missiles each, and ten Tir-II torpedo motorboats. If the Mad Max-style tactics of barreling towards enemies at maximum speed in swarms of over-gunned open-topped motor vehicles seems outlandish, it has a certain logic for Iran. The small and affordable boats have low radar signatures, which combined with speed, would significantly reduce their target’s reaction time. More importantly, their sheer numbers could overwhelm the expensive defensive systems onboard U.S. warships—if necessary, by running them dry of ammunition. A similar swarming missile strategy was creatively employed by Marine General Paul Van Riper, who led an Iran-like Red Team in a U.S. military exercise called the Millennium Challenge 2002. Van Riper launched a preemptive strike against an approaching U.S. amphibious force using a huge anti-ship cruise missile barrage that over-saturated their sophisticated Aegis air defense systems. This was combined with a swarming attack by fast boats. His attack sank sixteen ships and killed 20,000 Blue Team personnel. Van Riper apparently hadn’t understood that he was meant to lose the wargame in order to validate U.S. military doctrine, so the exercise was promptly rebooted to have the ‘right’ outcome. Although one can only extrapolate so much from a lone wargame, Van Riper’s tactics also illustrate that motorboat swarms would only be employed as a component in a larger strategy that would likely involve long-range land-based cruise missiles, ship and drone-based reconnaissance assets to cue those missiles onto target, midget submarine attacks and naval mines. Iran’s vast stock of over three thousand naval mines, for example, could gravely impede access to the Gulf, and could be deployed via small Ashora-class boats, submarines, corvettes, helicopters and so forth. Domestic Iranian drones or Iran’s bizarre ground-effect hovercraft could spy on the position of enemy ships and transmit targeting coordinates to land-based missiles. Iran has imported Chinese C802 Silkworm missiles with a strike range of 120 miles, as well as reverse-engineered its own domestic Noor cruise missile, and begun working on a 200-mile range Ghadir ASCM. And the Persian Gulf ranges in width only between 35 to 212 miles. It’s worth concluding by observing that Iran’s naval strategy is one of a military underdog seeking to deter stronger opponents. Tehran wants its enemies to fear that a Western war with Iran would result in extensive damage to the tankers carrying one-third of the world’s oil across the Straits of Hormuz, and for the U.S. Navy to think twice whenever it deploys aircraft carriers into the Persian Gulf. From the IRGCN’s standpoint, the U.S. Navy’s advanced warships bristling with missiles are the Death Star, and its swarms of fast boats the plucky, maneuverable fighters capable overwhelming advanced defenses to deal a lethal blow. Whether fast boat swarms could adequately leverage the narrow littoral waters of the Persian Gulf and prove effective versus modern warships has never truly been combat-tested—and hopefully, never will be. Sébastien Roblin holds a master’s degree in conflict resolution from Georgetown University and served as a university instructor for the Peace Corps in China. He has also worked in education, editing, and refugee resettlement in France and the United States. He currently writes on security and military history for War Is Boring. This first appeared in May 2019. Image: Reuters. Read the original article. "
4,rashida-tlaib-argues-pro-vaping-213301525.html,Rashida Tlaib argues with pro-vaping witness during hearing: Are you a conspiracy theorist?,"Tue, 24 Sep 2019 17:33:01 -0400","""Are you a conspiracy theorist?"" Rashida Tlaib asked the witness. ""I think my politics are entirely irrelevant to this hearing,"" Vicki Porter replied.",https://news.yahoo.com/rashida-tlaib-argues-pro-vaping-213301525.html,"In a House Oversight Committee hearing on vaping, Michigan Rep. Rashida Tlaib asked a pro-vaping witness if she is a conspiracy theorist, prompting a tense back-and-forth that ended in the chairman calling for order. Vicki Porter, a 51-year-old Wisconsin resident, was a witness at the ""Don't Vape"" hearing invited by the Republican committee members. After she gave testimony about her experience as a former smoker who was only able to quit nicotine after discovering electronic cigarettes.  ""It literally changed and probably saved my life,"" Porter testified. ""My lungs are healthy... Vaping is a health miracle to me."" Vaping lung illness: What we know about the recent spate of cases and deaths Tlaib spoke about the history of the tobacco industry and the evolution of the public's knowledge about the dangers of smoking.  ""It's so important that you all continue to speak truth about this, because the long-term effects is very dangerous, especially because they have been targeted towards youth,"" Tlaib said. The hearing on Tuesday was called in response to the recent Centers for Disease Control and Prevention warning about several deaths linked to vaping, though no specific cause has been identified for lung illnesses thus far. But things took a turn when Tlaib questioned Porter's motivations for appearing before the committee.  ""You know, Ms. Porter, I was reading because I want to know more about you and your beliefs,"" Tlaib said. ""You call yourself a converted conservative and a reformed Marxist,"" Tlaib continued. ""Are you a conspiracy theorist?"" ""I think my politics are entirely irrelevant to this hearing,"" Porter replied. ""Oh, OK, why were you winking at one of my colleagues on the other side of the aisle? You winked."" Tlaib asked. Porter responded, saying that she knows Wisconsin Rep. Glenn Grothman, who was present at the hearing.  ""He's a friend of mine,"" Porter said. ""I didn't know what the winking was,"" Tlaib said. ""I thought maybe there was something, like a conspiracy thing going on there. I didn't know."" ""You think there's a conspiracy in this hearing, ma'am?"" Porter said. The two went back and forth as Tlaib said Porter's idea of ""truth"" was different from many others at the hearing. ""The truth for me is I quit smoking with e-cigarettes and so did 8 million other people,"" Porter said as the two talked over each other."" ""You're still smoking, ma'am, you're still smoking,"" Tlaib fired back, referring to the fact that Porter now uses e-cigarettes. ""I'm not smoking,"" Porter said. As the chairman called for order, Porter added ""And I'm not lying under oath."" More: Trump's proposed ban on vape flavors may not stop teens from vaping, experts warn The committee's hearing comes as President Donald Trump is considering legislation that would ban the use of flavored e-cigarettes over concern that they are targeted toward children. According to a new report in Axios, conservative leaders are warning that Trump's proposed ban may hurt his re-election chances in battleground states with significant populations of adults who use vaping products. The state of Massachusetts has also recently banned sale of all vape products in the state for four months, and the city of San Francisco implemented a ban in June. While I like the Vaping alternative to Cigarettes, we need to make sure this alternative is SAFE for ALL! Let’s get counterfeits off the market, and keep young children from Vaping! This article originally appeared on USA TODAY: Rashida Tlaib accuses Republicans' pro-vaping witness of conspiracy "
5,stacey-abrams-breaking-rules-best-185245638.html,Stacey Abrams is breaking all the rules in the best way possible,"Wed, 25 Sep 2019 17:52:00 -0400","When it comes to politics, Stacey Abrams is a powerhouse -- and she has no plans on slowing down anytime soon.",https://news.yahoo.com/stacey-abrams-breaking-rules-best-185245638.html,"When it comes to politics, Stacey Abrams is a powerhouse -- and she has no plans on slowing down anytime soon.   The politician, lawyer and entrepreneur, gained national attention in 2018 when she ran against Brian Kemp for governor of Georgia. The race made history as Abrams became the first black woman to be a gubernatorial nominee for a major political party. Though she ultimately lost the election, her charisma and relatability won over the support of many. From the controversial loss, however, sprung Abrams' intensified advocacy for voters' right and the end of voter suppression across the country.  READ MORE: Senator Elizabeth Warren's net worth revealed as the 2020 Presidential Election heats up  Officially, Abrams has yet to concede, but she has recognized Kemp as the legal victor of the race.  “I’m not saying they stole it from me,” Abrams said at a National Action Network convention in New York City. “They stole it from the voters of Georgia.” Despite Abrams' high-profile status, she still makes time to spread words of encouragement to others who may not have thought a viable career in politics or any underrepresented industry is possible. ""My job is to be a voice for others,"" Abrams explained.  Abrams recently attended Bustle's second annual Rule Breakers event in New York where they celebrated the politician for breaking barriers in politics. The day-long festival ""honors women and non-binary individuals who are breaking barriers, shaping today’s culture, and defying expectations and the status quo.""  “You don't have to be born wealthy, you don't have to be born beautiful, you don't have to be born white, you don't have to be born into a family of brilliant people, you just have to be. By being, you're already started,” Abrams said.  The political icon has long been a figure of hope for marginalized communities, but for women of color, especially black women, in particular, Abrams' journey proves anything is possible with hard work, determination and 'breaking all the rules and creating new ones' if necessary.  ""It's not a detriment, it's an asset,"" she proudly exclaimed. ""I hope every single person who comes up to me, especially young women who are afraid to wear their natural hair or who don't think they're ready because they haven't lost the weight -- if you are ready, you are ready. You don't have to wait for the rest of the world because they never will be. They're ready when we show up."" she continued. As far as the next career move for Abrams, she responded, ""what I do next, has to be something I do because it helps me do the work I want to do in the best way possible."" She adds, however, that not running for office doesn't mean she's ""out of the process."""
