,id,title,date,author,description,link,full text
19,1.5296008,'Not your playground': Toronto vlogger slammed for violent Hong Kong protest video,"Tue, 24 Sep 2019 18:06:03 EDT",Adam Carter,A Toronto-born vlogger and photographer who drew ire for flying a drone over the Toronto Raptors’ NBA championship parade is now facing a backlash over a new video in which he travels to Hong Kong with a fake press pass to document violent clashes between protesters and police.,https://www.cbc.ca/news/canada/toronto/toby-gu-hong-kong-1.5296008?cmp=rss,"A Toronto-born vlogger and photographer who drew ire for flying a drone over the Toronto Raptors' NBA championship parade is now facing a backlash over a new video in which he travels to Hong Kong with a fake press pass to document violent clashes between protesters and police. In a video uploaded Monday, Toby Gu, 27, chronicles flying to the region on Sept. 22. At the outset, he describes the trip as ""pretty exciting stuff"" and talks about printing off a ""fake media pass"" and ordering a reflective vest on Amazon to pose as a reporter. The video includes graphic footage of a man being beaten, and confrontations between protesters and police. In many instances, Gu can be seen smiling and repeatedly jokes about being tear gassed. Gu said in one segment he was hoping for a ""confrontation"" and for ""bad things [to] happen.""  ""I don't want people to get hurt, but at the same time, that's what makes footage,"" he said. Gu's comments come from a second version of the video. He says he deleted the original and uploaded a new one that was ""very minimally edited"" to ""change the tone.""   There's no pleasing these people.- Toby Gu The new version also includes an apology. ""I wanted to share the brutality, the pain, and the difficulties that residents here in Hong Kong are experiencing every single day when they try to go out and fight for their freedom,"" he said in the video. ""Unfortunately at the same time I was trying to get more views, I was trying to get this video to explode, I was trying to get exposure — and it looks like I got that, but in a bad way."" Online reaction to the video was swift. It has been downvoted by thousands of users. ""Hong Kong is not your playground, Hong Kong is our home. It is not a game, it is about fight for our justice. Shame on you!"" wrote YouTube user Zoe Wong. Richard Scotford, a freelance journalist who has written for the Hong Kong Free Press, bemoaned YouTubers coming to the city ""to get sensational video for clicks and likes to boost their online presence. ""These thrill seekers are openly admitting they are faking their media documents, and this puts all the brave and valiant media who have been there every night at severe risk,"" Scotford wrote in a Facebook post. Gu said in his video that he printed off a 'fake media pass' for his trip. He later told CBC News that the information on the pass was 'true and verifiable.' (Toby Gu/YouTube) In an interview with CBC News, Gu said he wasn't prepared for the violence he saw in Hong Kong. He is now getting messages accusing him of being a ""communist spy,"" he added. ""I literally got a message about four hours ago from some guy [saying] 'Hey, I have a dagger prepared for your throat,'"" he said. Critics of his video are like ""dogs chasing a ball,"" Gu said. ""Realistically, I think I should have just kept my original video up,"" he said. ""There's no pleasing these people."" Months of protests Hong Kong's pro-democracy protests, now in their fourth month, have often descended into violence late in the day and at night. The protesters are angry about what they see as creeping Chinese interference in Hong Kong, which returned to Beijing's control 1997 under a ""one country, two systems"" formula intended to guarantee freedoms that are not enjoyed on the mainland. Hong Kong's leader, Chief Executive Carrie Lam, has agreed to withdraw an extradition bill that sparked the protests in June. But the anti-government protesters are pressing other demands, including fully democratic elections in the semi-autonomous Chinese territory and an independent investigation of complaints about police violence during earlier demonstrations. Anti-government protesters destroy a Chinese flag in the New Town Plaza at Sha Tin in Hong Kong on Sept. 22. (Aly Song/Reuters) Ivor Shapiro, a journalism professor at Ryerson University who specializes in media ethics, told CBC News instances like this exemplify how the very nature of who can be a reporter is in flux. ""All of these things that were once pretty clear — because it was pretty clear who was a journalist and who was not — none of them are clear anymore,"" Shapiro said. 'Brazen' drone footage of Raptors parade 'a slap in the face' to professional operators, pilot instructor says He also called credentialing ""virtually meaningless"" in 2019 — though it is problematic for anyone to lie about media credentials, he said. ""If there's any core professional value at all that is common to the idea of journalism in almost every place in the world, it is that particular commitment to telling the truth,"" he said. Drone footage Gu, for his part, told CBC News that he called his credentials a ""fake media pass"" just so he could get more views. ""The blog logo I have on that media pass, my name and what I'm doing is all real. All the information on that media pass is true and verifiable,"" he said. In the apology section of the video, Gu refers to himself as ""almost like an independent journalist"" — but he also refers to himself as a ""tourist"" in multiple occasions throughout the video. Gu also documents a fire in his video. He says he wasn't prepared for the violence he saw in Hong Kong. (Toby Gu/YouTube) This isn't his first brush with controversy. Transport Canada says it slapped a $2,750 fine on someone who flew a drone over Toronto during two separate Raptors-related celebrations this summer. Several videos of the celebrations were shot from the sky after the Raptors' win, and at least one of them was filmed by Gu, who at the time told CBC News he didn't believe he was endangering anyone. Gu said Tuesday that he has not yet been contacted by Transport Canada, but that he expects the fine is for him. adam.carter@cbc.ca"
20,1.5295463,Kevin O'Leary's wife charged in Muskoka area boat crash that killed 2,"Tue, 24 Sep 2019 12:47:56 EDT",CBC News,"Kevin O'Leary's wife, Linda, is facing a charge over a boat crash in the Muskoka area last month that left two people dead.",https://www.cbc.ca/news/canada/toronto/kevin-oleary-wife-charged-in-boat-crash-1.5295463?cmp=rss,"The wife of TV personality and businessman Kevin O'Leary is facing a single charge over a boat crash in the Muskoka area last month that left two people dead. Linda O'Leary, 56, is charged with careless operation of a vessel, in contravention of the Canada Shipping Act, small vessel regulations. The charge carries a maximum penalty of up to 18 months imprisonment or a fine of up to $1 million, or both. One other person is charged in connection with the collision, according to a news release issued Tuesday by the Ontario Provincial Police. Richard Ruh, 57, of Orchard Park, N.Y., has been charged with failing to exhibit a navigation light while underway, in contravention of Section 23 of the Canada Shipping Act, collision regulations. Staff Sgt. Carolle Dionne, a spokesperson for the OPP, said Tuesday the charges follow ""a thorough investigation."" ""Linda O'Leary's charges are before the courts, so there's very little other details that we can release to ensure a fair court proceeding,"" Dionne told CBC Toronto in a telephone interview. Kevin O'Leary's cottage on Lake Joseph is seen in this image taken by a drone last week. (CBC) Linda O'Leary an 'experienced boater' Linda O'Leary's lawyer Brian Greenspan described his client as ""a cautious and experienced boater."" He noted that police have charged the driver of the other boat with operating without a proper light, which may have contributed to the collision. ""On this dark evening, [O'Leary], on approaching her home, tragically came into contact with an unlit boat,"" Greenspan told CBC Toronto. ""She finds the entire matter tragic,"" he added. ""She's grief stricken.""  WATCH: The National's story on the boat crash  The collision occurred around 11:30 p.m. ET on Saturday, Aug. 24 near Emerald Island on Lake Joseph, a popular destination in the region about 215 kilometres north of downtown Toronto. Gary Poltash, 64, from Florida, died the night of the crash. Susanne Brito, 48, a mother of three from Uxbridge, Ont., died in hospital the following Tuesday. The collision occurred on Lake Joseph, a popular destination in Ontario's cottage country. (CBC) Three other people were taken to hospital with injuries and were released. Linda O'Leary suffered a leg injury that required surgery, Greenspan said. Just hours before the crash, Brito had posted a photo of the lake to social media with the words: ""Beautiful day! Enjoy."" Kevin O'Leary issued a statement following the crash to say he was a passenger in one of the boats involved in the collision and that he was co-operating with the police investigation.  O'Leary, a businessman and former Dragons' Den star on CBC, made a bid for the federal Conservative leadership race before dropping out in 2017. He now appears on the ABC show Shark Tank in the United States. Linda O'Leary is scheduled to appear in court in Parry Sound on Oct. 29. Greenspan said O'Leary's legal team will make the appearance on her behalf. Son of Muskoka boat crash victim starts GoFundMe for kids of 2nd victimHundreds attend funeral for Suzana Brito, victim of Muskoka boat crashKevin O'Leary confirms he was passenger in boat involved in double-fatal crash"
21,1.5296131,Ontario education unions turn up pressure on Doug Ford's government,"Tue, 24 Sep 2019 18:53:56 EDT",The Canadian Press,High school teachers and educational workers in Ontario turned up the pressure on the Progressive Conservative government on Tuesday as cracks continued to emerge in their contentious contract talks with the province.,https://www.cbc.ca/news/canada/toronto/osstf-bargaining-1.5296131?cmp=rss,"High school teachers and educational workers in Ontario turned up the pressure on the Progressive Conservative government on Tuesday as cracks continued to emerge in their contentious contract talks with the province. The Ontario Secondary School Teachers' Federation took the rare step of publicly releasing its bargaining proposals, saying it hopes the move will make negotiations more transparent. Union president Harvey Bischof said the Tory government has not been bargaining in good faith and has used procedural delays to slow negotiations. ""This government has rigged the system from the outset,"" he said. ""They've had their thumb on the scale since before negotiations began. We're going to take a different approach. One that puts transparency at the heart of our negotiations."" Bischof said the union's proposals include a request to roll back class size increases announced earlier this year and to link annual teacher pay raises to the consumer price index. The proposals also include a request to examine e-learning before moving ahead with a plan to make students take online courses in order to graduate. CUPE considering job action Meanwhile, CUPE's Ontario School Board Council of Unions, which represents custodians, clerical workers and early childhood educators, said it was considering a job action that could see them stop working overtime or perform any extra duties. Laura Walton said the work-to-rule campaign may be needed to pressure the government and school boards into reaching a fair agreement. CUPE education workers threaten 'disruptive' work-to-rule campaign ""My grandmother always said people don't notice what you do until you stop doing it,"" said Laura Walton, president of the Ontario School Board Council of Unions. ""It's time for the government and trustees' association to realize we've been cutting and cutting and cutting, and we just can't cut any further."" Last week, the union voted 93 per cent in favour of job action, putting them in a legal strike position on Monday, Sept. 30. Contracts for Ontario's public school teachers and education workers expired Aug. 31, and the major unions are in various stages of bargaining. The talks are happening as the government has ordered school boards to start increasing class sizes, moving to an average for high school from 22 to 28 over four years. Class sizes for grades 4 to 8 will increase by one student per classroom, from 23 to 24. The government has said that will mean 3,475 fewer teachers in the system over four years, which will be accomplished by not filling vacancies when teachers quit or retire. 'I want to reach a deal': education minister Education Minister Stephen Lecce said his negotiation team will continue to meet with OSSTF and urged CUPE to return to the bargaining table. ""I have stated consistently for months now, I want to reach a deal that provides predictability and certainty to students, parents and educators,"" he said. TimelineProtests, legal fights and stalled talks: Why Ontario schools could soon face labour disruptions NDP education critic Marit Stiles said the government could still avoid a labour disruption in the province's schools. ""If [Premier] Doug Ford was not continuing to move forward with his very deep cuts to education, cuts to classrooms, cuts that are affecting our students and our families, then we would not be here today,"" she said. Green party Leader Mike Schreiner said he supports the province's education workers as they push back against cuts made to the school system. ""Although the premier campaigned as if he would simply trim the fat, his cuts are digging into the bone, which is a direct threat to the quality of education in Ontario,"" Schreiner said in a statement."
22,1.5296226,Trudeau calls Singh to discuss blackface photos,"Tue, 24 Sep 2019 21:17:07 EDT",CBC News,NDP Leader Jagmeet Singh spoke to Justin Trudeau Tuesday about the Liberal leader's past appearances in blackface that emerged last week.,https://www.cbc.ca/news/politics/singh-trudeau-blackface-photos-phone-call-1.5296226?cmp=rss,"NDP Leader Jagmeet Singh has spoken to Justin Trudeau about the Liberal leader's past appearances in blackface that emerged last week. Singh received the private call from Trudeau as the NDP bus headed to Burnaby, B.C., for a campaign event Tuesday evening. Trudeau was forced to apologize repeatedly last week after Time magazine published a photo of him in brownface — wearing an Aladdin costume with his face, hands and arms darkened — at an Arabian Nights-themed gala when he was a teacher at a private school in B.C. in 2001. Trudeau admitted at the time to wearing blackface on an earlier occasion at a talent show in high school, an event captured in a yearbook photo. The next day, a video published by Global News showed him in blackface again at a summer rafting camp in the 1990s. 52% of B.C. voters say Justin Trudeau's blackface history is a 'serious' issue: pollAnalysisChampion of diversity or high-profile hypocrite? Who is Justin Trudeau, anyway? The Liberals said on Friday that Trudeau wanted to reach out to Singh, the first visible minority federal leader in Canada, to apologize personally for his behaviour. Reporters riding at the front of the NDP bus Tuesday did not hear the exchange and were told about it after the fact. The party did not share any details but said the call lasted 15 to 20 minutes. In a statement, the Liberal Party said it was a ""private conversation."" Singh, who spoke last week about the pain that racialized Canadians would feel when seeing the photos of the prime minister in blackface, said he would be willing to take the call, but only if it were private and were not used for political purposes. What we know about Justin Trudeau's blackface photos — and what happens nextSingh says he'll talk with Trudeau only if it's in private and politics-free At a town hall later Tuesday evening, Singh was asked about the call with Trudeau. ""Mr. Trudeau did call me. We did have a chat. I said that I wanted to keep the conversation private because I didn't want to be used as a tool in his exoneration,"" Singh said. ""But I also want to make it clear, it doesn't matter if he tells me anything. I'm not a proxy for the people of Canada.""  ""The people of Canada were hurt, they need to know that he understands. The people in Canada feel like he doesn't see the struggles they go through, that he ignores those struggles, and his policy decisions ignore those struggles,"" Singh said.  ""They need to know he cares."""
23,1.5296280,Windsor boy sends veteran to Belgium for first time since WWII,"Wed, 25 Sep 2019 08:00:00 EDT",Jason Viau,Using the tools in his own arsenal — a roadside lemonade stand and a barbecue — 10-year-old Aiden Dick raised enough money to fly a local veteran to a city in Belgium he hasn't seen since the Second World War.,https://www.cbc.ca/news/canada/windsor/veteran-gift-from-boy-1.5296280?cmp=rss,"Using the tools in his own arsenal — a roadside lemonade stand and a barbecue — 10-year-old Aiden Dick raised enough money to fly a local veteran to a city in Belgium he hasn't seen since the Second World War. Dick collected $989.50 and handed it to Sgt. Roy Hare inside of a sealed blue baggie on Tuesday. All of it came in just one day, mostly from complete strangers who stopped at his stand in Belle River, Ont. last month. ""I had this one lady drive all the way from who knows where to give me a $50 bill,"" said Dick. As the recipient, Hare will be able to fly to Ekeren, Belgium next month. It's a place he hasn't been since 1945, when the war ended. And he isn't sure the type of emotional reaction he'll have when he finally arrives. ""It's going to mean a great deal because it's places you've been before but of course I'll never recognize them now compared to when I was over there, because it was all in shambles,"" said Hare. ""The buildings were all bombed."" Aiden Dick said he was surprised when tallying up the donations he received, which totalled nearly $1,000. (Jason Viau/CBC) A local group, alongside Hare, will tour several war cemeteries and battle sites. Following that, there will be a parade and dedication ceremony with Belgian Army representatives and other dignitaries. Hare joined army at 18 Hare joined the Canadian Army when he was 18 and trained as an infantryman in Canada and England. He's also a part of the Essex & Kent Scottish Regiment — that's how Dick and Hare are indirectly connected, through the 10-year-old's father, Greg. Inspired by his father Dick's father inspired him to help those who fought for his freedom. Greg retired after 18 years, as someone who helped with logistical support. Now Dick is focusing his efforts on Project Ten Men, an online fundraising effort to support the 10 remaining Second World War veterans within the Essex & Kent Scottish Regiment. ""I'm really proud of myself for that,"" he said."
24,1.5296251,"Police investigating after pedestrian killed, 3-car crash in Scarborough","Tue, 24 Sep 2019 21:42:13 EDT",CBC News,Emergency crews responded to two collisions on Scarborough roadways Tuesday evening.,https://www.cbc.ca/news/canada/toronto/pedestrian-struck-scarborough-1.5296251?cmp=rss,"Emergency crews responded to two collisions on Scarborough roadways Tuesday evening that left one man dead and put two others in hospital.  The first came when police and paramedics were called to the scene of a pedestrian struck by a vehicle in the area of Danforth Avenue and Pharmacy Avenue at 8:46 p.m. According to police, a 2012 Mercedes — driven by a 41-year-old man — heading eastbound on the Danforth struck a male pedestrian. First responders rushed the man, aged 65, to hospital in life-threatening condition, paramedics said. He was pronounced dead in hospital.  Police are asking drivers, as well as local residents and business-owners, for any footage of the incident they might have captured. Several injured in seperate head-on collision The second collision came roughly a half-hour later, when police were called about a three-car crash in the area of Lawrence Avenue and Scarborough Golf Club Road. There was a head-on collision where a car ended up crashing into a pole, police said. Two drivers were taken to hospital with non-life-threatening injuries, officers say.  Boy, 17, dies after being struck by car in Scarborough The crash happened near the area where a 17-year-old boy was struck by a car on Monday evening. He later died in hospital."
25,1.5295735,Man found dead in parking lot after shooting in Etobicoke,"Tue, 24 Sep 2019 15:15:23 EDT",CBC News,Toronto police say they were called to the area of The West Mall and Rathburn Road around 1:20 p.m. for reports of a man shot in a parking lot.,https://www.cbc.ca/news/canada/toronto/man-found-dead-in-parking-lot-after-shooting-in-etobicoke-1.5295735?cmp=rss,"A man is dead after a shooting in Etobicoke on Tuesday afternoon. Toronto police say they were called to the area of The West Mall and Rathburn Road around 1:20 p.m. for reports of a man shot in a parking lot. Emergency crews said they found an adult male and paramedics treated him for life-threatening injuries. A short while later, Toronto police said that the victim was without vital signs. The homicide unit will investigate.  No information has been released about potential suspects.   "
26,1.5295761,Ontario post-secondary schools to study how students get around,"Tue, 24 Sep 2019 15:31:50 EDT",Nicole Thompson,A contingent of 10 universities and colleges in the Greater Toronto and Hamilton Area is launching a three-year research program examining how their students get around.,https://www.cbc.ca/news/canada/toronto/ontario-schools-transportation-research-partnership-1.5295761?cmp=rss,"A contingent of 10 universities and colleges in the Greater Toronto and Hamilton Area is launching a three-year research program examining how their students get around. The researchers will examine how the roughly 600,000 students who attend post-secondary schools in the region use transportation. The colleges and universities that have partnered with Metrolinx and the City of Toronto stretch as far west as McMaster University in Hamilton and as far east as Ontario Tech University in Oshawa. The research expands and builds on a previous study from the four universities in Toronto in 2015. Ryerson University says this is the largest study of its kind to date. Transport affects academic performance  Lead researcher Raktim Mitra says the program will provide important insights for urban planning. ""With such a large footprint, our universities and colleges are an important stakeholder in city-building, because our students create a significant demand for transportation, including transit,"" he said. ""And we understand that their transportation experiences and challenges have some impact on their academic performance, their well-being and whatnot."" 'Inconsistent' transit service makes for stressful introduction to university life, first-year student saysAudioChallenges for York University students who commute to campus Mitra, an associate professor at Ryerson's School of Urban and Regional Planning, said the study will help the universities understand what that impact is, and how to ensure students are on a level playing field. The study will also allow urban planners to factor students into their decisions, Mitra said. ""Through the data and our partnership with Metrolinx and the City of Toronto, we'll be able to identify key areas for improvement in transportation infrastructure that will improve this transportation experience for our students,"" he said. Study set to begin Oct. 1 The study is multi-phased, Mitra said, but the first and ""most significant"" is a massive survey of students that will take place between Oct. 1 and Nov. 15. He said he and his fellow researchers are hoping the study will provoke a discussion about the role that schools play in transportation planning. A self-driving shuttle is coming to Toronto's east endOn the Move: Commute from Hell  ""It's more than just a research project,"" he said. ""Instead, we are looking at it as a partnership between academic institutions, researchers like us, professionals, as well as the students. Through these partnerships, together we're trying to identify key problems and trying to promote a debate around this important issue."" This report from The Canadian Press was first published Sept. 24, 2019."
