,id,title,date,author,description,link,full text
0,1.5297702,"Salauddin Chowdhury, 65, identified as victim in fatal Scarborough crash","Wed, 25 Sep 2019 22:40:28 EDT",Julia Knope,"Family members have identified Salauddin Chowdhury, 65, as the victim killed in a three-car crash in Scarborough Tuesday evening. ",https://www.cbc.ca/news/canada/toronto/salauddin-chowdhury-victim-killed-three-car-crash-scarborough-1.5297702?cmp=rss,"Family members have identified Salauddin Chowdhury, 65, as the victim of a fatal crash that happened in Scarborough Tuesday evening.  Police say he was walking in the area of the area of Danforth Avenue and Pharmacy Avenue just before 9 p.m. when he crossed the street mid-block and was struck by a vehicle less than a block from his home.  He was rushed to hospital, where he died.  Emma Anwar, one of Chowdhury's eight grandchildren, said he was walking home from the mosque when it happened. Although the father of four died just over a day ago, Anwar said there's already been an overwhelming response from the community.  ""All these strangers are coming in saying 'I knew your grandfather,'"" Anwar told CBC Toronto Wednesday.  Emma Anwar, granddaughter of Salauddin Chowdhury, says she wants the city to add more crosswalks in the area.  (Angelina King/CBC) ""He was funny. He was really nice. Everyone knew him around here. He talked to everybody.""  And he was always walking, she said.  Chowdhury moved to Toronto six years ago from Bangladesh, where friends say he had worked as a city councillor for 18 years.  ""[He] never made a complaint against anybody,"" said Parbez Ahmed, a family member. Parbez Ahmed, a relative of Salauddin Chowdhury, says speed limits in the area should be reduced.  (Chris Langenzarde/CBC)  He says he was in the hospital until midnight Tuesday night with the rest of the family.  ""I miss him a lot.""  'For a senior, it's very hard' Now Anwar hopes the city will make changes to tackle pedestrian safety.  And she says the answer is simple: add more crosswalks.  ""There's one down the street, but the other one is so far down,"" she said. ""He was old, so it just takes a little bit longer.""  Posters commemorating Salauddin Chowdhury at the scene of the fatal accident.  (Angelina King/CBC) Kaniz Fatima, a family friend, says it's very sad to accept an accident like this.  ""For a senior, it's very hard,"" she said. ""Just keep him in your prayers.""  Most vulnerable pedestrians are elderly So far this year, 27 pedestrians have been killed in Toronto — and 10 of those deaths happened in Scarborough, according to Toronto Police Sgt. Brett Moore.  Of those 27 victims, more than 80 per cent were 55 years or older.  ""It's [a] fact that a vulnerable person — a senior member of our society — is way over-represented in the statistics, and so that's a demographic that we are focused on and trying to connect with more and more,"" Moore said.  SAFER STREETSAfter a woman was killed while crossing the street, what needs to change at Yonge and Erskine? SAFER STREETSWhere are Toronto's most dangerous intersections? You told us  Now, in an attempt to curb the fatalities, he's encouraging people to talk to their elderly family members or friends about road safety.  ""We're kind of reminding people, if you have seniors in your in your life ... have a conversation about walking across the street,"" Moore said.  ""Yes, it's about traffic enforcement. Yes, it's about engineering. Yes, it's about educating and talking to people. But it's also getting people to recognize some of the risky behaviours that we all have. Nobody's perfect.""  Speed, alcohol not factors in crash Moore said there could be ""kilometres in between intersections or crosswalks,"" which is why some people cross mid-block.  And according to Det. Joe Kranjak, that's exactly what happened in the crash that killed Chowdhury.  According to police, a 2012 Mercedes — driven by a 41-year-old man — heading eastbound on the Danforth at 8:46 p.m. hit the victim as he was crossing between intersections.  Police say they continue to investigate Tuesday's fatal crash.  (Michael Rich/CBC)  Kranjak said officers have talked to witnesses and viewed surveillance video, but are still canvassing for more footage.  Although police are still in early stages of the investigation, he said speed and alcohol don't appear to be factors.  No charges have been laid so far in the investigation. "
1,1.5297192,Noticing more roadkill around Toronto? You're not the only one,"Wed, 25 Sep 2019 19:50:39 EDT",Julia Knope,"When Louise Piper came across a dead raccoon on the sidewalk in front of her neighbour's house last Saturday, she didn't think it would still be there four days later — after all, it was wrapped in a plastic bag and appeared ready to be picked up. ",https://www.cbc.ca/news/canada/toronto/roadkill-toronto-streets-backlog-1.5297192?cmp=rss,"When Louise Piper came across a dead raccoon on the sidewalk in front of her neighbour's house, she didn't think it would still be there four days later — after all, it was wrapped in a plastic bag and appeared ready to go.  ""[It was] pretty vile to be honest, to be left there in the heat,"" Piper told CBC Toronto.  It was Saturday when she first came across the dead animal in a bag on the ground. When Monday rolled around and it was still there, she took to Twitter to get the city's attention.  This is how he was looking today at 12.30! Cooking well in that midday sunshine! <a href=""https://twitter.com/TOAnimalService?ref_src=twsrc%5Etfw"">@TOAnimalService</a> <a href=""https://twitter.com/311Toronto?ref_src=twsrc%5Etfw"">@311Toronto</a> <a href=""https://twitter.com/cityoftoronto?ref_src=twsrc%5Etfw"">@cityoftoronto</a> <a href=""https://t.co/ZmvGstXhdO"">pic.twitter.com/ZmvGstXhdO</a>&mdash;@Piperl86  ""I could start to smell it and there was flies,"" Piper said.  But two days later the creature still hadn't been cleaned up. ""I could smell it up here ... about four or five houses up,"" Piper said.  Finally, at some point on Wednesday — day four — the animal was picked up by Toronto Animal Services.  ""I'm glad it's gone,"" she said. Louise Piper says it's concerning that children can walk by dead animals that haven't been picked up for several days.  (Vedran Lesic/CBC) Delays up to 10 days  It turns out there's a reason for the delays — the city says it's dealing with a backlog of 260 requests for dead animal removal.  Normally, it's supposed to take between 48 and 72 hours — but in a tweet to Piper, 311 Toronto warned that because of the high volume, it could now take up to 10 days for the city to collect animal carcasses.  Unfortunately, due to the high volume of dead animal reporting, it can take up to approx. 10 days to remove the dead animal.^as&mdash;@311Toronto  In a statement, animal services said the city prioritizes the removal of certain animals, which affects wait times for the remaining requests.  ""Removal timelines may vary for a number of reasons, including the prioritization of sick and injured animals, increased demand as animals become more active in warmer weather, and availability of Animal Care and Control Officers,"" the statement reads.  'This is really kind of a health hazard'  Piper said she's uncomfortable having her child in close proximity to a rotting animal.  ""It's pretty gross when you have a small child and you're walking down here every day,"" Piper said.  She's not the only one with concerns.  Michael Januska says he and his wife both called 311 last week to ask that a dead raccoon be picked up from the middle of the sidewalk near St. Clair Avenue and Mount Pleasant Boulevard.  Resident Michael Januska says he's been waiting over a week for the city to clean up a dead raccoon near the intersection of St. Clair Avenue and Mount Pleasant Boulevard.  (Mehrdad Nazarahari/CBC) It's been there for a week and counting.  ""We are waiting and waiting and thinking, this is really kind of a health hazard. There's kids and families walking by, people walking their dogs,"" Januska told CBC Toronto Wednesday. ""It's just getting worse and worse. It's attracting flies."" 'There's a nice little evidence of it left there,' Louise Piper said of the spot on the sidewalk where the bagged raccoon had been left for several days.  (Vedran Lesic/CBC) Now he says the animal is in ""an advanced stage of decomposition.""  ""If this is a volume issue, how many other animal cadavers are around the city in public spaces, public parks, that have to be dealt with?"" he said.  ""I think the city is waiting for it to turn to dust and blow away.""  What to do if you come across roadkill   According to the city's website, you can submit a service request for the removal of a dead animal online or over the phone — although there's no telling exactly how long it will take to get picked up.  VideoIs Toronto the raccoon capital of Canada? Roadkill for dinner? Rules vary by province and territory in Canada  The city warns residents not to touch the animals with their bare hands, but to wear gloves and place the carcass in a plastic bag. While Toronto Animal Services will pick up larger animals, the city's Solid Waste Management Services will pick up smaller wildlife, like mice, rats, small birds, or chipmunks. "
2,1.5296397,"Less student supervision, less school cleaning: memo outlines CUPE's work-to-rule plan","Wed, 25 Sep 2019 08:36:32 EDT",CBC News,A union representing education workers and the Ontario government have scheduled two days of last-minute contract talks in an effort to avoid a work-to-rule campaign.,https://www.cbc.ca/news/canada/toronto/cupe-work-to-rule-latest-1.5296397?cmp=rss,"A union representing education workers and the Ontario government have scheduled two days of last-minute contract talks in an effort to avoid a work-to-rule campaign. CUPE, which represents 55,000 education workers in Ontario, has formally submitted notice that puts it in a legal strike position as of Monday. The new meetings between the union, province and the Council of Trustees' Associations are set for Saturday and Sunday. The union also took the step Wednesday of outlining what work-to-rule will look like. No CUPE member will ever do anything to make a school unsafe or put students at risk, officials say. However, memos sent to workers contain a long list of tasks that won't get done. That includes, but is not limited to, the following actions outlined in a memo to members:  Clerical staff have been explicitly told ""do not supervise children."" Those workers will also stop updating the school's websites and social media feeds. Education assistants will not allow any class to proceed unless a teacher is present, nor will they participate in nutrition programs. Custodians will similarly not supervise students, nor will they pick up garbage outside, or clean ""Ministry unfunded areas"" including hallways, offices and gyms. Maintenance and Trade members will complete repairs only if the parts are in stock and on hand.  CUPE is just one of the unions locked in talks with Doug Ford's PC government. So far, none have been able to reach a deal, raising the concern of a widespread school strike that could happen this fall. The talks are happening as the government has ordered school boards to start increasing class sizes, moving to an average of 28 for high schools over four years, up from 22. Class sizes for Grades 4 to 8 will increase from 23 to 24. The government has said that will mean 3,475 fewer teachers in the system over four years, a cut it says will be accomplished by not filling vacancies when teachers quit or retire. Ontario Education Minister Stephen Lecce has repeatedly said the government is committed to reaching a deal that provides stability for workers, parents and students alike. Union says its fighting for workers and students Laura Walton, the president of CUPE's Ontario School Board Council of Unions, said her union is trying to protect its workers (ranging from education assistants to custodians to early childhood educators), and the services students receive. TimelineProtests, legal fights and stalled talks: Why Ontario schools could soon face labour disruptionsOntario education unions turn up pressure on Doug Ford's government ""This year we've seen those services decimated: school libraries closed over students' lunch breaks because there aren't enough library workers; school cleaning cut to the point that custodians are told they can only vacuum kindergarten classrooms once a week; eight or nine students with special needs now supported by a single education assistant; communications with parents affected because some schools have lost their school secretaries,"" Walton said in a news release.   ""If it takes job action to restore these services, then so be it."""
3,1.5297405,1 dead following industrial accident in North York,"Wed, 25 Sep 2019 17:45:39 EDT",CBC News,"One person is dead following an industrial accident in North York, Toronto paramedics say. ",https://www.cbc.ca/news/canada/toronto/one-died-industrial-accident-north-york-1.5297405?cmp=rss,"One person is dead following an industrial accident in North York, Toronto paramedics say.  It happened earlier Wednesday afternoon in the area of Wilson Avenue and Highway 400. Paramedics say the victim was pronounced dead at the scene.  According to a statement from Ontario's Ministry of Labour, the victim reportedly worked for Fiera Foods, a bakery located near Wilson Avenue and Clayson Road.  ""Our thoughts are with the family and colleagues of the workers who passed away. Our investigation is ongoing,"" said Ministry of Labour spokesperson Charlene Millet.  A ministry inspector has been assigned to investigate the incident, Millet added.   "
4,1.5296649,Leafs star Auston Matthews regrets 'distraction' of disorderly conduct charge,"Wed, 25 Sep 2019 12:00:34 EDT",Joshua Clipperton,"Maple Leafs star Auston Matthews said he regrets if any of his actions are a distraction to his team after news broke Tuesday of Matthews facing a charge of disorderly conduct and disruptive behaviour after an incident in his hometown of Scottsdale, Ariz., in May.",https://www.cbc.ca/sports/hockey/nhl/auston-matthews-disorderly-conduct-regrets-statement-1.5296649?cmp=rss,"Moments after Auston Matthews delivered a 38-second statement where the Toronto Maple Leafs' star said he regrets if any of his actions are a distraction to the team, John Tavares was asked if that's exactly what's happening. ""Well, we've got a lot of people here today,"" said the veteran centre. ""But we're focused on the ice.""Maple Leafs star Auston Matthews facing disorderly conduct charge in Arizona The media throng assembled at the Leafs' practice facility had other ideas Wednesday, less than 24 hours after news broke that Matthews is facing a charge of disorderly conduct and disruptive behaviour stemming from an alleged May incident in his hometown of Scottsdale, Ariz. Having dozens of reporters and cameras on hand for the morning skate wouldn't raise eyebrows in the playoffs, but this was ahead of an exhibition game in late September against a skeleton Montreal Canadiens' roster. WATCH | Matthews speaks at Leafs' practice: Maple Leafs star Auston Matthews comments on the alleged May incident in his hometown of Scottsdale, Ariz. 4:07 Any controversy involving the Leafs is big news in Toronto — Matthews made the front page of the local daily newspapers Wednesday — and the added detail that the team's best player has been charged days before many observers expected him to be named captain has sparked even more intrigue. One of the first players off the ice Wednesday, Matthews briefly went into the locker room and emerged after a member of the Leafs' public relations staff said the 22-year-old centre wouldn't be taking any questions. ""It's not something that I think any of us really wish we were talking about today. Unfortunately, it's the situation we're in,"" said Matthews, still sporting his equipment. ""I regret any of my actions that would ever put a distraction on the team or distress any individual. ""I take a lot of pride in preparing myself for the season and representing the Toronto Maple Leafs as well as I can. Unfortunately due to the situation, I'm afraid I can't really make any other comments."" WATCH: Matthews charged with disorderly conduct: Hearing in Arizona today over incident with security guard. 2:27 Tavares, Leafs head coach Mike Babcock and defenceman Morgan Rielly all said they first learned of the allegation Tuesday. It's unclear if anyone in the organization knew about the charge before this week. ""You're always disappointed,"" Babcock said. ""As the Toronto Maple Leafs, we really pride ourselves on doing things right — on the ice, off the ice — in treating people. ""It's an unfortunate situation."" Rielly said the team will rally around Matthews. ""It's tough,"" he said. ""He's taking it very seriously. We understand that these issues are serious and it's not something that we take lightly."" Court date set for Oct. 22 A pre-trial conference was held in Arizona on Wednesday. The City of Scottsdale's website lists the next court date as Oct. 22. NHL deputy commissioner Bill Daly declined a request via email for comment when asked about the allegation. The player's agent and Phoenix-based lawyer also didn't respond to separate requests for comment. A police report obtained from the Scottsdale Police Department details the complaint filed by a female security guard employed by a local condo building where she said Matthews is a resident. She said she was sitting in her locked car when a group of men, including Matthews, allegedly tried to get inside on May 26. She said she confronted the group, who she believed to be intoxicated, and during that interaction Matthews withdrew from the conversation and dropped his pants and grabbed his butt cheeks. NHL centres say new faceoff rule should help scoring Tka-ching: Matthew Tkachuk strikes 3-year, $21M US deal with Flames The security guard said Matthews, then 21 years old, kept his underwear on. None of the allegations have been proven in court. Matthews was not arrested. ""Anything that goes bad, what you do is you take it and you get better as an organization,"" Babcock said. ""We've got a close family inside and we're going to look after Auston and we're going to look after our actions."" The coach added that he spoke to Matthews, who was expected to play against Montreal, on Wednesday morning to make sure the fourth-year pro was OK. ""I'm here for our players,"" Babcock added. ""I'm here to help them become better men and better people and better players."" Rielly was wrongly accused of uttering a homophobic slur on the ice during a game last season, and said the attention controversial situations garner in hockey-crazed markets can be difficult to handle. ""You just try not to read about it,"" Rielly said. ""We know Auston, what kind of person he is and how he acts on a day-to-day basis. This doesn't change things for his teammates."" Candidate for Leafs captain Matthews has been considered one of the leading candidates to be the named Leafs' captain, a role that's been vacant since Dion Phaneuf was traded to the Ottawa Senators in February 2016. Tavares and Rielly are also possibilities for the job — it's anyone's guess what the allegation means for Matthews' case to wear the 'C' — but they said his position within the team hierarchy is secure. It was hard not to notice, however, the captain-like poise both showed Wednesday morning under difficult circumstances. ""It's easy to cast judgment and want to make assumptions, but I think you just let the process carry out,"" Tavares said. ""We have belief in (Matthews) as a player and what he brings to our locker room."" ""He's been a leader since Day 1 (when) he walked in this room,"" Rielly said. ""We're going to support him."""
