,id,title,date,author,description,link,full text
8,1.5290037,How climate change gave added urgency to a $1.25B project to prevent flooding in Toronto,"Wed, 25 Sep 2019 04:00:00 EDT",Lauren Pelley,"Toronto is spending $1.25 billion on a massive flood-protection project on the city's waterfront, which involves building a new river system. The project highlights the lengths some Canadian communities will have to go to brace for the impact of a changing climate in the years ahead.",https://www.cbc.ca/news/canada/toronto/toronto-flooding-climate-change-1.5290037?cmp=rss,"In May 2017, record-breaking levels in Lake Ontario left much of the Toronto islands underwater throughout the summer. The following year, a powerful storm hit the city in August, dropping more than 64 millimetres of rain in just a two-hour span. The rising water washed out roadways, backed up sewage, submerged vehicles, flooded basements, and trapped two men in a north-end elevator filled with six feet of water — leaving them only a foot of air to breathe when they were finally rescued by police.  Before many residents had finished clearing liquid muck from their homes, another round of torrential rain flooded buildings and basements all over again a week later. Is this the new normal for residents in Canada's largest city? ""We know that storms are getting stronger. They're becoming more frequent,"" said David Kusturin, chief project officer for Waterfront Toronto, the organization tasked with revitalizing the city's waterfront area. 'We know that storms are getting stronger. They're becoming more frequent,' says David Kusturin, chief project officer for Waterfront Toronto. For Kusturin, bracing for the next crisis is top of mind as he leads a $1.25-billion flood-protection project in Toronto's Port Lands area. (Lauren Pelley/CBC News)  For Kusturin, bracing for the next crisis is top of mind as he leads a $1.25-billion flood-protection project in Toronto's Port Lands district, a man-made, 100-hectare contaminated chunk of waterfront property. The massive, years-long effort will create a new river system capable of preventing catastrophic flooding in the surrounding area. And the project becomes increasingly important as the city keeps experiencing record-breaking lake levels and powerful storm systems, which city officials warn could get worse thanks to climate change. For Toronto, preventing the next potentially disastrous flood is increasingly urgent. And it's a reality facing many Canadian communities as they try to brace for the impacts of a changing climate in the years ahead.  A city on alert Three months after last year's double whammy of storms, flooding was on city officials' minds yet again as representatives from all three levels of government attended the groundbreaking for the Port Lands flood-protection project in November. The nearly 300-hectare area in Toronto's Port Lands and eastern waterfront area that's currently at risk of flooding from the powerful Don River. (Supplied by Waterfront Toronto) The project aims to prevent flooding throughout a nearly 300-hectare chunk of land surrounding the mouth of the Don River — a flood plain that's around the same size as the downtown core — while allowing for new development. Dubbed ""one of the most ambitious construction programs in Toronto's history"" by Waterfront Toronto, the effort was more than a decade in the making. ""It was being developed for the 100-year storm,"" explained Coun. Paula Fletcher, whose riding includes the Port Lands. ""But we are certainly having storms that are very big, more often."" This expanse, currently filled with heavy machinery, will one day be the site of a one-kilometre river valley in the Port Lands. The new river will connect with the Don River.  (Lauren Pelley/CBC News) Data from the city's resilience strategy, released earlier this year, notes the annual precipitation is expected to jump from around 790 millimetres to more than 850 millimetres by the year 2051. And when it comes to heavy precipitation days — where more than 20 millimetres falls in one go — the number each year could jump from just over 6½ days to close to eight in the same period. That's a particularly concerning trend for the Port Lands. The area is a huge expanse of concrete, built overtop wetlands once forming the natural mouth of the powerful, 38-kilometre-long Don River, which weaves through the city from the north. Please Explain: Where the major parties stand on climate changeAnalysisFighting climate change is not like fighting a war. It's harder During a major storm, water rushes down the river, and when it hits the Port Lands, an industrial area now mostly known for crumbling roads and dilapidated buildings, the water has nowhere to go, forcing it to surge into homes and businesses to the north and east. ""As soon as the first few drops of rain fall on the Don River watershed, it's like turning a tap on — the river starts flowing right away,"" said river science specialist Joe Desloges, a professor of geography and earth sciences at the University of Toronto. ""It's not just the fact you have an urban river that's very responsive to any weather event,"" he said. ""Now you've added the extreme event of climate change on top of that."" Preventing disaster To prevent a future disaster, hundreds of workers are spending roughly six years creating a new river valley. ""We are extending the Don River and creating new areas for the flood waters,"" Kusturin said. Decked out in a hard hat and reflective vest, he's standing on ground that didn't exist this time last year.  Tornadoes, floods make climate change key issue among voters'How dare you': At UN climate summit, Greta Thunberg slams world leaders in emotional address The rocky area on the northwestern edge of the Port Lands was created by shipping in around 240,000 cubic metres of shale bedrock from other construction sites. Along one stretch of the rebuilt shoreline, water flows from Lake Ontario through a grate — designed to keep out invasive fish species — and into a manufactured pond filled with dead trees, which will slowly decompose and create a new aquatic environment. This area of the development will provide five hectares of land and shoreline, which will one day feature park spaces and wetlands — returning the area to its natural state while creating an elevated, protected area for new homes and businesses. The project's goal is to protect a huge chunk of land from flooding by transforming the Port Lands from a concrete jungle to a river valley. On the northwestern edge, new land is being created by shipping in around 240,000 cubic metres of shale bedrock from other construction sites. Workers are also building a river to stretch across the area and collect surging storm water from the mouth of the Don River to the north.  Further east, an expanse currently filled with heavy machinery will be the site of the one-kilometre river valley.  The winding route will start at the mouth of the Don River at the north end of the Port Lands and stretch west, creating a new island ecosystem to the south. What that means is river water will gain another entry point to Lake Ontario alongside the man-made Keating Channel, which requires water to make an unnatural, hard right turn before it reaches the lake. Set to open in 2024, the river valley will allow flood waters to take a meandering course through a natural environment — and the banks will be reinforced to withstand fast-flowing waters if there's a big storm. Millions in 150 countries protest for climate actionCanadian youth pledge not to have children until politicians act on climate change Workers using massive drill rigs are building the concrete supports for the river. ""We've been under construction on this part of the project for about 12 months ... the work that's happening all around us is constructing cut-off walls to act as structure when we excavate the river,"" Kusturin said. The 38-kilometre-long Don River, seen here alongside a stretch of Toronto's Don Valley Parkway, winds from the Oak Ridges Moraine all the way south to Lake Ontario.  (Lauren Pelley/CBC News) That excavation will involve moving more than a million cubic metres of soil to build up the valley walls, elevate the land, and create wide swaths of parkland, he said. When the project is finished, those involved hope the Port Lands will be transformed from a concrete wasteland to a new community, balancing natural and urban environments, providing a new space for living and leisure — and, most crucially, keeping the water at bay. While there are years of work ahead, one climate change expert says Toronto's billion-dollar effort could inspire other cities.  Canada is warming at two to three times the rate of the rest of the world, said international climate change specialist Elliott Cappell, Toronto's former chief resilience officer, which means regions across the country need to be bracing for the impact of rising temperatures. But the specific approach depends on the area, he said. Most of the country's population lives in major cities, which could face issues like basement flooding and dangerously high summer heat in older apartment towers. In the coastal regions, rising sea levels pose a threat. In the North, the big concern is permafrost melting. Concept art shows what the Port Lands could look like in the years to come, including this eastward view from a future bridge overlooking the new river and parkland. (Supplied by Waterfront Toronto) For Toronto, Cappell said, a single waterfront project won't change the grim reality — in the decades ahead, the city is going to get ""hotter, wetter and wilder."" ""We need to make climate change part of everything we do,"" he said. ""It has to be part of how we maintain our roads, how we plan our city blocks and buildings, how we maintain parks."" John Tory says it's time for Toronto to declare a climate emergencyMississauga to roll out draft $450M climate change action plan"
9,1.5295961,Trudeau's claim that Canada is 'on track' to meet 2030 climate target is misleading,"Wed, 25 Sep 2019 12:39:30 EDT",Lucas Powers,"There is still time for Canada to meet its Paris Agreement commitment, but it would require ramped-up climate change policies.",https://www.cbc.ca/news/politics/trudeau-climate-change-2030-fact-check-1.5295961?cmp=rss,"As part of our federal election coverage, CBC News is assessing the truthfulness and accuracy of statements made by politicians and their parties. The Claim: ""Canada is on track to reduce our emissions by 30 per cent by 2030 compared to 2005 levels."" — Liberal Leader Justin Trudeau on his government's efforts to fight climate change The Facts: In late 2015, Canada and 194 other countries adopted the Paris Agreement, which aims to hold the global average temperature increase to well below 2 C above pre-industrial levels, with the ultimate goal of limiting the rise to only 1.5 C. As part of that multinational consensus, Canada committed to reducing its annual greenhouse gas emissions to 30 per cent below 2005 levels by 2030 — a level first set by Stephen Harper's Conservative government. On the campaign trail this week, Trudeau repeatedly said his Liberals have put Canada ""on track"" to meet that target -- and are now promising to exceed it. What you need to know to vote in Canada's federal electionPOLL TRACKERConservatives hold slim poll lead, Liberals only marginally ahead in seats But reports issued by his own government undermine that claim. Environment and Climate Change Canada (ECCC) regularly publishes updates on the country's progress in reducing greenhouse gas emissions. In January, the department projected that even under a best-case scenario — one that takes into account policies already in place and those that are ""under development but have not yet been fully implemented"" — our total emissions in 2030 will only be 19 per cent below 2005 levels. In other words, all the climate-related policies that were on the table as of January this year would get us 63 per cent of the way to the 2030 target. Climate change and energy experts are quick to point out that projections, while valuable predictive tools, are not necessarily representations of the future. The accelerating pace of technological advancement and the possibility that federal governments will adopt more aggressive climate change policies mean that Canada could end up meeting or even surpassing its 2030 target. And Liberal candidates like to point to measures in the 2019 federal budget — such as a $5,000 electric vehicle incentive — that have not been factored into the most recent projections. Similarly, the Trudeau government helped to fund up to 1000 green energy projects across Canada, many of which will not be operational before 2022 or 2023 but will contribute to emissions reductions.  Liberals promise to halve tax rate for clean tech companies as part of long-range climate action planConservatives highlight home renovation credit as part of climate plan As things stand, however, even the most optimistic outlook relies on what the government calls ""emerging and future"" reductions — in other words, policies and technologies that don't yet exist. Kathryn Harrison, a professor of political science at the University of British Columbia, said that until more details emerge on the policies a re-elected Liberal government might pursue, Trudeau's claim that we are on track to meet our 2030 goal is ""misleading."" ""The Liberals haven't put meat on the bones yet. They haven't told us, specifically, what are those measures and what are the reductions that will be accomplished by them,"" said Harrison, who is also a chemical engineer. Net-zero pledge Harrison said she was somewhat surprised when, on Tuesday, the Liberal campaign said that it would commit Canada to reaching net-zero emissions by 2050. The announcement came a day after the United Nations climate summit, where more than 65 other countries made the same pledge. According to the Intergovernmental Panel on Climate Change, the net-zero commitment is needed to reach the aspirational goals of the Paris Agreement and prevent catastrophic environmental consequences. It is an ambitious target and it's not yet clear how any country could get there — because it has never been done before. When pressed for specifics on what a re-elected Liberal government would do, Liberal candidate and Trudeau environment minister Catherine McKenna punted. ""Do we have all the details? No,"" McKenna said at the announcement. ""We're going to figure this out, but the first thing we need to do is we need to get through this election."" CLIMATE CHANGEConfronting carbon: Here's what it would take for Canada to meet its climate targetsAnalysisLack of details in promises gives Liberals room to move but also raises questions She also listed off a host of policies the Trudeau government implemented during its mandate, including the pan-Canadian framework on climate change that includes a price on carbon — considered by many economists to be the most effective way to curb emissions. Harrison said that a commitment to net-zero emissions is laudable but it's ""a bit cynical"" for the pledge to come in the middle of an election campaign. ""Especially for a government that doesn't have a concrete plan in place to meet its 10-year target,"" she said.  Verdict: Misleading Sources: Canada's Greenhouse Gas and Air Pollutants Emissions Projections, 2018, Environment and Climate Change Canada; Canada sets carbon emissions reduction target of 30% by 2030, CBC News; Progress towards Canada's greenhouse gas emissions reduction target, Environment and Climate Change Canada; Summary for Policymakers of IPCC Special Report on Global Warming of 1.5°C approved by governments, Intergovernmental Panel on Climate Change; Closing the gap: carbon pricing for the Paris target (Revised June 20, 2019), Parlimentary Budget Officer; Climate Action Tracker; UN report on global warming carries life-or-death warning, CBC News"
10,1.5296630,Police rule out homicide after human remains found in North York dumpster,"Wed, 25 Sep 2019 12:07:29 EDT",CBC News,"The human remains found in a North York dumpster earlier this week are not the result of a homicide, Toronto police said Wednesday.",https://www.cbc.ca/news/canada/toronto/human-remains-found-in-dumpster-1.5296630?cmp=rss,"The human remains found in a North York dumpster earlier this week are not the result of a homicide, Toronto police said Wednesday. Police were called to an apartment near Harrison Garden Boulevard and Oakburn Crescent shortly after 8:30 a.m. Monday after a building superintendent located what looked like a body part in a dumpster. A Toronto police spokesperson offered few details about the investigation Wednesday, saying only that ""this is not a homicide."" ""This is a non-criminal investigation, no risk to public safety,"" Const. Caroline de Kloet said in an email to CBC Toronto. She added that police will not comment ""out of respect to those involved,"" Possible human remains found in North York dumpster"
11,1.5295765,Toronto-born woman living in U.S. 'ecstatic' about voting in Canadian election for first time,"Wed, 25 Sep 2019 05:00:00 EDT",Nicole Brockbank,"So far more than 31,700 Canadians living abroad have registered to vote in next month’s federal election, including some expats who get to mark their first ballot in decades.",https://www.cbc.ca/news/canada/toronto/expats-voting-federal-election-1.5295765?cmp=rss,"More than 31,700 Canadians living abroad have registered to vote so far in next month's federal election, including some expats who get to mark their first ballot in decades. Last December, the Liberal government passed legislation that guaranteed voting rights to all Canadians residing outside the country, and a month later the Supreme Court of Canada affirmed the Charter right to vote for expats. For Christine Mossman Gallagher, 44, the change meant voting for the first time ever. She dropped off her ballot at her local post office in Dallas, Ga. on Monday.  ""I teared up a little bit,"" said Mossman Gallagher. ""It was just such a feeling of empowerment, 'Like hey, even though it's only one vote, I still got to vote.'"" The school librarian was born in Toronto, grew up in Whitby, Ont. and then moved down to the U.S. in 1995 after high school because her father got a job in Georgia. More than two decades later, Mossman Gallagher's still there, but considers Canada home. For her, the right to vote is a chance to help her parents who moved back to Ontario, and settled in Muskoka, after her father was diagnosed with multiple sclerosis. Christine Mossman Gallagher, far left, and other Canadians living in the Atlanta area regularly go watch the Blue Jays play when the baseball team travels to Atlanta, Ga. (Submitted by Christine Mossman Gallagher) ""I want to be able to take care of them even if it's from a thousand miles away,"" Mossman Gallagher told CBC Toronto. ""I feel like being able to vote and making my voice heard in terms of health care would make a big difference for them."" Each year, Mossman Gallagher spends her summer in Muskoka with her family and plans to move back to Canada with her husband and daughter after she retires.  ""I want to go to a country that I feel proud to live in, that takes care of the environment, takes care of its people, she said. ""Sometimes I don't feel that here [in the U.S.]."" 42% of expats registered live in the U.S. About 42 per cent of Canadian expats registered to vote next month live in the U.S. like Mossman Gallagher — followed by the United Kingdom with nearly 12 per cent of those registered and Hong Kong with five per cent, according to Elections Canada.  Before the writs were issued on Sept. 11, nearly 19,800 Canadians living abroad had registered to vote, and in the two weeks since roughly another 12,000 have registered.   Top 10 jurisdictions where Canadian expats registered to vote: Elections Canada    Jurisdiction Expats registered % of Total   United States 13,456 42.37%   United Kingdom 3,682 11.59%   Hong Kong 1,588 5.00%   Australia 1,437 4.53%   Germany 1,303 4.10%   France 1,201 3.78%   Switzerland 719 2.26%   Netherlands 569 1.79%   Japan 469 1.48%   China (excluding Hong Kong & Macao) 418 1.32%   Total of Top 10 24,842 78.23%   Grand Total 31,756 100.00      Araz Najarian is one of about 570 expats in the Netherlands planning to vote in this election. Born and raised in Toronto, Najarian moved to the European country on a year-long contract back in 2006 and then decided to stay, building a life for herself in the port city of Rotterdam.  Supreme Court of Canada guarantees voting rights for expats Climate change and opportunities for small businesses are two issues she's eager to weigh in on through her vote.  ""I'm a partner in a company here in the Netherlands and I would like to bring more of that business to Canada,"" Najarian told CBC Toronto.  Like Mossman Gallagher, she also has family in Canada and visits her parents in Toronto often.  Araz Najarian moved to the Netherlands in 2006, and now lives in the port city Rotterdam. (Submitted by Araz Najarian) ""I still have a life in Canada — even if it's far,"" said Najarian. ""For me, it's quite important I get to have a chance to also voice my perspective because I'm always going to keep coming back."" CBC Toronto spoke to half a dozen other expats about why getting to vote is important to them. Most of them shared similar sentiments about being happy to have a voice again, plans to move back to Canada eventually, and concerns about far-right politics.  Despite their enthusiasm, one expert says the number of expats registered to vote actually shows how ""detached"" those living abroad are from Canada. Expat votes will have no effect on election: expert For example, University of Toronto political science professor Nelson Wiseman told CBC Toronto more than 300,000 Canadians are estimated to be living in Hong Kong, but less than 2,000 of them are registered to vote.  What you need to know to vote in Canada's federal election Overall, Wiseman thinks that even if all of the expats registered end up voting it won't make a difference in the election. ""I don't think the expat vote is going to have any effect,"" said Wiseman. ""There are 338 ridings, you do a little math there and it's not very many votes.""  No matter the impact, Mossman Gallagher says she is still ""absolutely ecstatic"" to finally have some say in an election. ""I feel completely powerless down here in the States where I can't vote."""
